url,link_text,post_title,page
https://www.aei.org/technology-and-innovation/permissionless-innovation-during-covid-19-and-beyond-highlights-from-my-conversation-with-adam-thierer/,‘Permissionless Innovation’ During COVID-19 and Beyond: Highlights from My Conversation with Adam Th...,‘Permissionless Innovation’ During COVID-19 and Beyond: Highlights from My Conversation with Adam Thierer,19
https://www.aei.org/podcast/permissionless-innovation-during-covid-19-and-beyond-with-adam-thierer/,Explain to Shane: ‘Permissionless Innovation’ During COVID-19 and Beyond (with Adam Thierer),Explain to Shane: ‘Permissionless Innovation’ During COVID-19 and Beyond (with Adam Thierer),20
https://www.aei.org/technology-and-innovation/virtualized-networks-and-o-ran-will-be-key-for-american-5g-success/,Virtualized Networks and O-RAN Will Be Key for American 5G Success,Virtualized Networks and O-RAN Will Be Key for American 5G Success,20
https://www.aei.org/technology-and-innovation/the-future-of-micromobility-highlights-from-my-conversation-with-michele-kyrouz/,The Future of Micromobility: Highlights from My Conversation with Michele Kyrouz,The Future of Micromobility: Highlights from My Conversation with Michele Kyrouz,20
https://www.aei.org/podcast/the-future-of-micromobility-with-michele-kyrouz/,Explain to Shane: The Future of Micromobility (with Michele Kyrouz),Explain to Shane: The Future of Micromobility (with Michele Kyrouz),20
https://www.aei.org/technology-and-innovation/using-blockchain-to-beat-covid-19-highlights-from-my-conversation-with-shane-bigelow/,Using Blockchain to Beat COVID-19: Highlights from My Conversation with Shane Bigelow,Using Blockchain to Beat COVID-19: Highlights from My Conversation with Shane Bigelow,20
https://www.aei.org/podcast/explain-to-shane-using-blockchain-to-beat-covid-19/,‘Explain to Shane’: Using Blockchain to Beat COVID-19,‘Explain to Shane’: Using Blockchain to Beat COVID-19,20
https://www.aei.org/technology-and-innovation/telecom-supply-chain-security-and-5g-highlights-from-my-discussion-with-david-stehlin/,Telecom Supply Chain Security and 5G: Highlights from My Discussion with David Stehlin,Telecom Supply Chain Security and 5G: Highlights from My Discussion with David Stehlin,20
https://www.aei.org/podcast/explain-to-shane-telecom-supply-chain-security-and-5g-with-david-stehlin/,Explain to Shane: Telecom Supply Chain Security and 5G with David Stehlin,Explain to Shane: Telecom Supply Chain Security and 5G with David Stehlin,20
https://www.aei.org/technology-and-innovation/highlights-from-my-discussion-with-roger-entner-on-broadband-capacity-and-the-covid-19-pandemic/,COVID-19 and Broadband Networks: Highlights from My Discussion with Roger Entner,COVID-19 and Broadband Networks: Highlights from My Discussion with Roger Entner,20
https://www.aei.org/podcast/explain-to-shane-covid-19s-impact-on-broadband-networks/,Explain to Shane: Roger Entner Explains Broadband Network Capacity amid the COVID-19 Pandemic,Explain to Shane: Roger Entner Explains Broadband Network Capacity amid the COVID-19 Pandemic,20
https://www.aei.org/technology-and-innovation/amid-covid-19-zoom-learns-the-importance-of-consumer-privacy-and-security/,"Amid COVID-19, Zoom Learns the Importance of Consumer Privacy and Security","Amid COVID-19, Zoom Learns the Importance of Consumer Privacy and Security",20
https://www.aei.org/technology-and-innovation/facing-covid-19-the-fcc-and-private-sector-come-together-to-keep-americans-connected/,"Facing COVID-19, the FCC and Private Sector Come Together to Keep Americans Connected","Facing COVID-19, the FCC and Private Sector Come Together to Keep Americans Connected",20
https://www.aei.org/technology-and-innovation/key-points-from-the-cyberspace-solarium-commission-report/,Key Points from the Cyberspace Solarium Commission Report,Key Points from the Cyberspace Solarium Commission Report,20
https://www.aei.org/technology-and-innovation/lessons-from-the-equifax-hack/,Lessons from the Equifax Hack,Lessons from the Equifax Hack,20
https://www.aei.org/technology-and-innovation/ces-2020-envisioning-a-digital-future-powered-by-good-policies/,CES 2020: Envisioning a Digital Future Powered by Good Policies,CES 2020: Envisioning a Digital Future Powered by Good Policies,20
https://www.aei.org/technology-and-innovation/californias-privacy-law-shows-that-congressional-action-is-needed/,California’s Privacy Law Shows That Congressional Action Is Needed,California’s Privacy Law Shows That Congressional Action Is Needed,20
https://www.aei.org/technology-and-innovation/the-privacy-debate-is-really-about-data-collection-and-federalism/,The Privacy Debate Is Really About Data Collection and Federalism,The Privacy Debate Is Really About Data Collection and Federalism,20
https://www.aei.org/technology-and-innovation/the-fcc-takes-the-threat-from-chinese-telecommunications-tech-head-on-and-the-rest-of-government-should-too/,The FCC Takes the Threat from Chinese Telecommunications Tech Head-on (and the Rest of the Governmen...,The FCC Takes the Threat from Chinese Telecommunications Tech Head-on (and the Rest of the Government Should Too),20
https://www.aei.org/technology-and-innovation/securing-the-internet-starts-with-planning-and-awareness/,Securing the Internet Starts with Planning and Awareness,Securing the Internet Starts with Planning and Awareness,20
https://www.aei.org/technology-and-innovation/how-much-do-you-trust-your-browser-are-they-search-engines-or-ad-platforms/,How Much Do You Trust Your Browser? Are They Search Engines or Ad Platforms?,How Much Do You Trust Your Browser? Are They Search Engines or Ad Platforms?,20
https://www.aei.org/technology-and-innovation/to-discuss-concerns-about-privacy-and-data-sharing-we-must-understand-how-big-tech-uses-apis/,"To Discuss Concerns About Privacy and Data Sharing, We Must Understand How Big Tech Uses APIs","To Discuss Concerns About Privacy and Data Sharing, We Must Understand How Big Tech Uses APIs",21
https://www.aei.org/technology-and-innovation/ransomware-learning-from-the-mistakes-of-others/,Ransomware: Learning from the Mistakes of Others,Ransomware: Learning from the Mistakes of Others,21
https://www.aei.org/technology-and-innovation/telecommunications/ensuring-the-proper-use-of-educational-wireless-spectrum-licenses/,Ensuring the Proper Use of Educational Wireless Spectrum Licenses,Ensuring the Proper Use of Educational Wireless Spectrum Licenses,21
https://www.aei.org/technology-and-innovation/global-financial-inclusion-is-the-next-challenge-for-tech-innovators/,Global Financial Inclusion Is the Next Challenge for Tech Innovators,Global Financial Inclusion Is the Next Challenge for Tech Innovators,21
https://www.aei.org/technology-and-innovation/the-implications-of-accepting-cryptocurrency-for-tax-payments/,The Implications of Accepting Cryptocurrency for Tax Payments,The Implications of Accepting Cryptocurrency for Tax Payments,21
https://www.aei.org/technology-and-innovation/telecommunications/should-big-tech-be-the-sole-operator-of-the-internets-domain-name-infrastructure/,Should Big Tech Be the Sole Operator of the Internet’s Domain Name Infrastructure?,Should Big Tech Be the Sole Operator of the Internet’s Domain Name Infrastructure?,21
https://www.aei.org/technology-and-innovation/is-an-interagency-kerfuffle-between-the-fcc-and-noaa-a-threat-to-the-future-of-5g-wireless/,Is an Interagency Kerfuffle Between the FCC and NOAA a Threat to the Future of 5G Wireless?,Is an Interagency Kerfuffle Between the FCC and NOAA a Threat to the Future of 5G Wireless?,21
https://www.aei.org/technology-and-innovation/telecommunications/on-5g-wireless-economic-growth-huawei-and-security-a-long-read-qa-with-roger-entner/,"On 5G Wireless, Economic Growth, Huawei, and Security: A Long-read Q&A with Roger Entner","On 5G Wireless, Economic Growth, Huawei, and Security: A Long-read Q&A with Roger Entner",21
https://www.aei.org/technology-and-innovation/cybersecurity-insurance-a-market-solution-to-a-pressing-problem/,Cybersecurity Insurance: A Market Solution to a Pressing Problem,Cybersecurity Insurance: A Market Solution to a Pressing Problem,21
https://www.aei.org/technology-and-innovation/national-institute-of-standards-and-technologys-privacy-framework-and-a-more-measured-approach-to-privacy/,National Institute of Standards and Technology’s Privacy Framework and a More Measured Approach to P...,National Institute of Standards and Technology’s Privacy Framework and a More Measured Approach to Privacy,21
https://www.aei.org/technology-and-innovation/huawei-makes-false-promises-on-5g-security-as-one-of-the-five-eyes-goes-blind/,Huawei Makes False Promises on 5G Security as One of the ‘Five Eyes’ Goes Blind,Huawei Makes False Promises on 5G Security as One of the ‘Five Eyes’ Goes Blind,21
https://www.aei.org/technology-and-innovation/icann-encourages-registry-operators-to-adopt-industry-best-practices-and-rights-protection-measures/,ICANN Encourages Registry Operators to Adopt Industry Best Practices and Rights Protection Measures,ICANN Encourages Registry Operators to Adopt Industry Best Practices and Rights Protection Measures,21
https://www.aei.org/technology-and-innovation/government-engagement-is-needed-for-5g-mobile-technologies-to-reach-their-potential/,Government Engagement Is Needed for 5G Mobile Technologies to Reach Their Potential,Government Engagement Is Needed for 5G Mobile Technologies to Reach Their Potential,21
https://www.aei.org/technology-and-innovation/innovation/digital-identities-and-privacy-time-to-change-how-domain-names-are-registered/,Digital Identities and Privacy: Time to Change How Domain Names Are Registered?,Digital Identities and Privacy: Time to Change How Domain Names Are Registered?,21
https://www.aei.org/events/perspectives-on-data-privacy-from-the-federal-trade-commission-and-department-of-justice/,Perspectives on Data Privacy from the Federal Trade Commission and Department of Justice,Perspectives on Data Privacy from the Federal Trade Commission and Department of Justice,21
https://www.aei.org/technology-and-innovation/number-one-on-the-list-of-bad-ideas-for-data-privacy-protection/,Number One on the List of Bad Ideas for Data Privacy Protection,Number One on the List of Bad Ideas for Data Privacy Protection,21
https://www.aei.org/technology-and-innovation/huawei-5g-wireless-and-known-unknowns/,"Huawei, 5G Wireless, and “known Unknowns”","Huawei, 5G Wireless, and “known Unknowns”",21
https://www.aei.org/technology-and-innovation/telecommunications/on-internet-policy-congress-should-look-to-the-future-not-the-past/,"On Internet Policy, Congress Should Look to the Future, Not the Past","On Internet Policy, Congress Should Look to the Future, Not the Past",21
https://www.aei.org/technology-and-innovation/how-to-build-data-privacy-trust-between-businesses-and-customers/,How to Build Data Privacy Trust Between Businesses and Customers,How to Build Data Privacy Trust Between Businesses and Customers,21
https://www.aei.org/technology-and-innovation/innovation/mobile-social-and-cloud-will-boost-artificial-intelligence/,"Mobile, Social, and Cloud Will Boost Artificial Intelligence","Mobile, Social, and Cloud Will Boost Artificial Intelligence",21
https://www.aei.org/technology-and-innovation/as-problems-with-data-and-misinformation-mount-securing-networks-and-data-is-more-critical-than-ever/,"As Problems with Data and Misinformation Mount, Securing Networks and Data Is More Crucial Than Ever","As Problems with Data and Misinformation Mount, Securing Networks and Data Is More Crucial Than Ever",22
https://www.aei.org/technology-and-innovation/innovation/distributed-ledger-technology-supply-chains-and-the-romaine-recalls-of-the-future/,"Distributed Ledger Technology, Supply Chains, and the Romaine Recalls of the Future","Distributed Ledger Technology, Supply Chains, and the Romaine Recalls of the Future",22
https://www.aei.org/technology-and-innovation/the-internet-of-things-and-cybersecurity-a-qa-with-sen-edward-j-markey-d-ma-and-rep-ted-lieu-d-ca/,The Internet of Things and Cybersecurity: A Q&A with Sen. Edward J. Markey (D-MA) and Rep. Ted Lieu ...,The Internet of Things and Cybersecurity: A Q&A with Sen. Edward J. Markey (D-MA) and Rep. Ted Lieu (D-CA),22
https://www.aei.org/technology-and-innovation/the-us-and-the-digital-future-at-the-international-telecommunication-union/,The US and the Digital Future at the International Telecommunication Union,The US and the Digital Future at the International Telecommunication Union,22
https://www.aei.org/technology-and-innovation/who-is-the-whois-for/,Who Is the WHOIS For?,Who Is the WHOIS For?,22
https://www.aei.org/technology-and-innovation/time-to-rethink-how-we-value-our-online-identities/,Time to Rethink How We Value Our Online Identities,Time to Rethink How We Value Our Online Identities,22
https://www.aei.org/technology-and-innovation/investing-in-mobile-infrastructure-will-be-key-for-the-5g-future/,Investing in Mobile Infrastructure Will Be Key for the 5G Future,Investing in Mobile Infrastructure Will Be Key for the 5G Future,22
https://www.aei.org/events/clearing-obstacles-to-americas-5g-wireless-future-a-conversation-with-fcc-commissioner-brendan-carr/,Clearing Obstacles to America’s 5G Wireless Future: A Conversation with FCC Commissioner Brendan Car...,Clearing Obstacles to America’s 5G Wireless Future: A Conversation with FCC Commissioner Brendan Carr,22
https://www.aei.org/technology-and-innovation/telecommunications/how-5g-wireless-will-bring-innovation-to-main-street-america/,How 5G Wireless Will Bring Innovation to Main Street America,How 5G Wireless Will Bring Innovation to Main Street America,22
https://www.aei.org/technology-and-innovation/digital-identities-and-the-future-of-technology/,Digital Identities and the Future of Technology,Digital Identities and the Future of Technology,22
https://www.aei.org/technology-and-innovation/what-exactly-is-governments-role-in-addressing-misinformation-online/,What Exactly Is Government’s Role in Addressing Misinformation Online?,What Exactly Is Government’s Role in Addressing Misinformation Online?,22
https://www.aei.org/technology-and-innovation/can-internet-of-things-security-be-improved-by-the-government-procurement-process/,Can Internet of Things Security Be Improved by the Government Procurement Process?,Can Internet of Things Security Be Improved by the Government Procurement Process?,22
https://www.aei.org/technology-and-innovation/innovation/societys-tech-addiction-can-be-a-force-for-good/,Society’s Tech Addiction Can Be a Force for Good,Society’s Tech Addiction Can Be a Force for Good,22
https://www.aei.org/technology-and-innovation/an-internet-privacy-balancing-act-the-cost-of-free-apps/,An Internet Privacy Balancing Act: The Cost of ‘free’ Apps,An Internet Privacy Balancing Act: The Cost of ‘free’ Apps,22
https://www.aei.org/technology-and-innovation/innovation/blockchain-is-more-than-just-the-technology-behind-bitcoin/,Blockchain Is More Than Just the Technology Behind Bitcoin,Blockchain Is More Than Just the Technology Behind Bitcoin,22
https://www.aei.org/technology-and-innovation/the-fbi-overstated-the-going-dark-problem-and-the-facts-on-encryption-remain-the-same/,"The FBI Overstated the ‘going Dark’ Problem, and the Facts on Encryption Remain the Same","The FBI Overstated the ‘going Dark’ Problem, and the Facts on Encryption Remain the Same",22
https://www.aei.org/technology-and-innovation/privacy-and-europes-data-protection-law-problems-and-implications-for-the-us/,Privacy and Europe’s Data Protection Law: Problems and Implications for the US,Privacy and Europe’s Data Protection Law: Problems and Implications for the US,22
https://www.aei.org/technology-and-innovation/improving-internet-security-through-awareness-and-risk-management/,Improving Internet Security Through Awareness and Risk Management,Improving Internet Security Through Awareness and Risk Management,22
https://www.aei.org/technology-and-innovation/silicon-valleys-path-to-regaining-consumer-trust-on-privacy/,Silicon Valley’s Path to Regaining Consumer Trust on Privacy,Silicon Valley’s Path to Regaining Consumer Trust on Privacy,22
https://www.aei.org/technology-and-innovation/implications-of-the-cloud-act-for-the-future-of-data/,Implications of the Cloud Act for the Future of Data,Implications of the Cloud Act for the Future of Data,22
https://www.aei.org/technology-and-innovation/protecting-privacy-shouldnt-come-at-the-expense-of-a-safer-more-secure-internet/,"Protecting Privacy Shouldn’t Come at the Expense of a Safer, More Secure Internet","Protecting Privacy Shouldn’t Come at the Expense of a Safer, More Secure Internet",23
https://www.aei.org/technology-and-innovation/telecommunications/forget-the-cra-what-the-internet-needs-is-legislation/,Forget the Congressional Review Act: What the Internet Needs Is Legislation,Forget the Congressional Review Act: What the Internet Needs Is Legislation,23
https://www.aei.org/technology-and-innovation/how-european-data-protection-law-is-upending-the-domain-name-system/,How European Data Protection Law Is Upending the Domain Name System,How European Data Protection Law Is Upending the Domain Name System,23
https://www.aei.org/events/securing-the-internet-of-things-a-conversation-with-sen-ed-markey-d-ma-and-rep-ted-lieu-d-ca/,Securing the Internet of Things: A Conversation with Sen. Edward J. Markey (D-MA) and Rep. Ted Lieu ...,Securing the Internet of Things: A Conversation with Sen. Edward J. Markey (D-MA) and Rep. Ted Lieu (D-CA),23
https://www.aei.org/technology-and-innovation/innovation/what-is-governments-role-in-securing-the-internet-of-things/,What Is Government’s Role in Securing the Internet of Things?,What Is Government’s Role in Securing the Internet of Things?,23
https://www.aei.org/technology-and-innovation/innovation/keys-to-the-smart-cities-of-tomorrow-technology-partnerships-and-the-internet-of-things/,Keys to the Smart Cities of Tomorrow: Technology Partnerships and the Internet of Things,Keys to the Smart Cities of Tomorrow: Technology Partnerships and the Internet of Things,23
https://www.aei.org/technology-and-innovation/innovation/consumer-data-powers-the-information-economy-but-is-more-transparency-needed/,"Consumer Data Power the Information Economy, but Is More Transparency Needed?","Consumer Data Power the Information Economy, but Is More Transparency Needed?",23
https://www.aei.org/technology-and-innovation/telecommunications/investing-in-5g-and-the-next-generation-digital-age-infrastructure/,"Investing in 5G and the Next-generation, Digital-age Infrastructure","Investing in 5G and the Next-generation, Digital-age Infrastructure",23
https://www.aei.org/technology-and-innovation/telecommunications/the-fcc-at-work/,The FCC at Work,The FCC at Work,23
https://www.aei.org/technology-and-innovation/innovation/the-politics-of-internet-domain-names-and-the-case-of-amazon/,The Politics of Internet Domain Names and the Case of .amazon,The Politics of Internet Domain Names and the Case of .amazon,23
https://www.aei.org/technology-and-innovation/telecommunications/does-strong-competition-mean-wireless-could-surpass-wired-broadband-in-the-near-future/,Does Strong Competition Mean Wireless Could Surpass Wired Broadband in the near Future?,Does Strong Competition Mean Wireless Could Surpass Wired Broadband in the near Future?,23
https://www.aei.org/technology-and-innovation/innovation/to-make-the-5g-wireless-future-possible-government-and-industry-must-cooperate/,"To Make the 5G Wireless Future Possible, Government and Industry Must Cooperate","To Make the 5G Wireless Future Possible, Government and Industry Must Cooperate",23
https://www.aei.org/technology-and-innovation/digital-trade/protecting-privacy-in-a-data-driven-world/,Protecting Privacy in a Data-driven World,Protecting Privacy in a Data-driven World,23
https://www.aei.org/technology-and-innovation/innovation/to-secure-internet-of-tomorrow-think-outside-the-net-neutrality-box/,"To Secure the Internet of the Future, Think Outside the Net Neutrality Box","To Secure the Internet of the Future, Think Outside the Net Neutrality Box",23
https://www.aei.org/technology-and-innovation/innovation/preparing-for-the-future-by-securing-the-internet-of-things/,Preparing for the Future by Securing the Internet of Things,Preparing for the Future by Securing the Internet of Things,23
https://www.aei.org/technology-and-innovation/telecommunications/internet-regulation-freedom-innovate/,Internet Regulation and the Freedom to Innovate,Internet Regulation and the Freedom to Innovate,23
https://www.aei.org/technology-and-innovation/telecommunications/set-free-next-wave-internet-innovation/,Set Free the Next Wave of Internet Innovation,Set Free the Next Wave of Internet Innovation,23
https://www.aei.org/technology-and-innovation/cyber-responsibility-protecting-old-systems-new-attacks/,Cyber Responsibility: Protecting Old Systems from New Attacks,Cyber Responsibility: Protecting Old Systems from New Attacks,23
https://www.aei.org/technology-and-innovation/new-threats-countermeasures-digital-world/,New Threats and Countermeasures in the Digital World,New Threats and Countermeasures in the Digital World,23
https://www.aei.org/technology-and-innovation/telecommunications/repealing-net-neutrality-implications-cybersecurity/,Repealing Net Neutrality: Implications for Cybersecurity,Repealing Net Neutrality: Implications for Cybersecurity,23
https://www.aei.org/technology-and-innovation/innovation/americas-tech-titans-havent-stymied-innovation-theyve-enabled/,America’s Tech Titans Haven’t Stymied Innovation: They’ve Enabled It,America’s Tech Titans Haven’t Stymied Innovation: They’ve Enabled It,24
https://www.aei.org/technology-and-innovation/sharing-economy-benefits-access-ownership/,The Sharing Economy: Benefits of Access over Ownership,The Sharing Economy: Benefits of Access over Ownership,24
https://www.aei.org/events/maximizing-the-internet-of-things-a-conversation-with-senator-cory-booker-d-nj-and-senator-deb-fischer-r-ne/,Maximizing the Internet of Things: A Conversation with Senator Cory Booker (D-NJ) and Senator Deb Fi...,Maximizing the Internet of Things: A Conversation with Senator Cory Booker (D-NJ) and Senator Deb Fischer (R-NE),24
https://www.aei.org/articles/toward-a-connected-future-maximizing-the-internet-of-things/,Toward a Connected Future: Maximizing the Internet of Things,Toward a Connected Future: Maximizing the Internet of Things,24
https://www.aei.org/technology-and-innovation/gets-measured-gets-done-risks-rewards-cybersecurity/,What Gets Measured Gets Done: The Risks and Rewards of Cybersecurity,What Gets Measured Gets Done: The Risks and Rewards of Cybersecurity,24
https://www.aei.org/articles/improving-cybersecurity-through-cooperation-not-regulation/,"Improving Cybersecurity Through Cooperation, Not Regulation","Improving Cybersecurity Through Cooperation, Not Regulation",24
https://www.aei.org/technology-and-innovation/ces-2017-type-can-talk/,CES 2017: Why Type When You Can Talk?,CES 2017: Why Type When You Can Talk?,24
https://www.aei.org/technology-and-innovation/telecommunications/importance-local-content-increasing-global-internet-connectivity/,The Importance of Local Content for Increasing Global Internet Connectivity,The Importance of Local Content for Increasing Global Internet Connectivity,24
https://www.aei.org/technology-and-innovation/dhs-right-sue-iot-manufacturers-poor-security/,Is DHS Right to Sue IoT Manufacturers over Poor Security?,Is DHS Right to Sue IoT Manufacturers over Poor Security?,24
https://www.aei.org/technology-and-innovation/effects-using-carrot-less-stick-improve-cybersecurity/,"The Effects of Using More Carrot, Less Stick, to Improve Cybersecurity","The Effects of Using More Carrot, Less Stick, to Improve Cybersecurity",24
https://www.aei.org/technology-and-innovation/need-need-avoid-improve-cybersecurity-digital-shared-network-economy/,What You Need – and Need to Avoid – to Improve Cybersecurity in a Digital Shared Network Economy,What You Need – and Need to Avoid – to Improve Cybersecurity in a Digital Shared Network Economy,24
https://www.aei.org/articles/the-iana-transition-creating-a-responsible-outcome/,The IANA Transition: Creating a Responsible Outcome,The IANA Transition: Creating a Responsible Outcome,24
https://www.aei.org/technology-and-innovation/coordinated-efforts-actually-making-progress-cybersecurity/,"Through Coordinated Efforts, We Are Actually Making Progress on Cybersecurity","Through Coordinated Efforts, We Are Actually Making Progress on Cybersecurity",24
https://www.aei.org/technology-and-innovation/telecommunications/wireless-fiber-solution-google-fibers-cost-challenges/,Wireless Fiber: A Solution to Google Fiber’s Cost Challenges?,Wireless Fiber: A Solution to Google Fiber’s Cost Challenges?,24
https://www.aei.org/technology-and-innovation/just-like-happiness-cybersecurity-choice/,"Just like Happiness, Cybersecurity Is a Choice","Just like Happiness, Cybersecurity Is a Choice",24
https://www.aei.org/articles/lessons-from-deltas-meltdown-the-importance-of-having-a-backup-plan/,Lessons from Delta’s Meltdown: The Importance of Having a Backup Plan,Lessons from Delta’s Meltdown: The Importance of Having a Backup Plan,24
https://www.aei.org/articles/russians-arent-just-hacking-the-dnc-they-are-hacking-america/,Russians Aren’t Just Hacking the DNC – They Are Hacking America,Russians Aren’t Just Hacking the DNC – They Are Hacking America,24
