url,link_text,post_title,page
https://www.aei.org/podcast/integrating-extended-reality-into-education-work-and-daily-life-with-david-scurlock/,"Integrating Extended Reality into Education, Work, and Daily Life (with David Scurlock)","Integrating Extended Reality into Education, Work, and Daily Life (with David Scurlock)",10
https://www.aei.org/technology-and-innovation/its-time-for-a-federal-privacy-law-that-works-in-todays-digital-ecosystem/,It’s Time for a Federal Privacy Law That Works in Today’s Digital Ecosystem,It’s Time for a Federal Privacy Law That Works in Today’s Digital Ecosystem,10
https://www.aei.org/podcast/how-paypal-laid-the-groundwork-for-silicon-valley-as-we-know-it-with-jimmy-soni/,How PayPal Laid the Groundwork for Silicon Valley as We Know It (with Jimmy Soni),How PayPal Laid the Groundwork for Silicon Valley as We Know It (with Jimmy Soni),10
https://www.aei.org/technology-and-innovation/congress-takes-another-stab-at-chip-funding-highlights-from-a-conversation-with-peter-cleveland-and-jon-hoganson/,Congress Takes Another Stab at Chip Funding: Highlights from a Conversation with Peter Cleveland and...,Congress Takes Another Stab at Chip Funding: Highlights from a Conversation with Peter Cleveland and Jon Hoganson,11
https://www.aei.org/technology-and-innovation/the-challenge-of-putting-federal-broadband-funds-to-good-use-highlights-from-my-conversation-with-mark-jamison/,The Challenge of Putting Federal Broadband Funds to Good Use: Highlights from My Conversation with M...,The Challenge of Putting Federal Broadband Funds to Good Use: Highlights from My Conversation with Mark Jamison,11
https://www.aei.org/events/can-billions-of-dollars-in-federal-grants-solve-broadband-access-and-availability-throughout-the-us/,Can Billions of Dollars in Federal Grants Solve Broadband Access and Availability Throughout the US?,Can Billions of Dollars in Federal Grants Solve Broadband Access and Availability Throughout the US?,11
https://www.aei.org/podcast/congressional-chip-funding-are-we-there-yet-with-peter-cleveland-and-jon-hoganson/,Congressional Chip Funding: Are We There Yet? (with Peter Cleveland and Jon Hoganson),Congressional Chip Funding: Are We There Yet? (with Peter Cleveland and Jon Hoganson),11
https://www.aei.org/podcast/the-challenge-of-putting-federal-broadband-funds-to-good-use-with-mark-jamison/,The Challenge of Putting Federal Broadband Funds to Good Use (with Mark Jamison),The Challenge of Putting Federal Broadband Funds to Good Use (with Mark Jamison),11
https://www.aei.org/events/crossing-the-consumer-welfare-rubicon-a-conversation-with-commissioner-noah-phillips-of-the-federal-trade-commission/,Crossing the Consumer Welfare Rubicon: A Conversation with Commissioner Noah Phillips of the Federal...,Crossing the Consumer Welfare Rubicon: A Conversation with Commissioner Noah Phillips of the Federal Trade Commission,11
https://www.aei.org/technology-and-innovation/the-implications-of-a-progressive-regulatory-regime-at-the-federal-trade-commission/,The Implications of a Progressive Regulatory Regime at the Federal Trade Commission,The Implications of a Progressive Regulatory Regime at the Federal Trade Commission,11
https://www.aei.org/technology-and-innovation/an-update-on-us-intellectual-property-policy-highlights-from-my-conversation-with-michael-rosen/,An Update on US Intellectual Property Policy: Highlights from My Conversation with Michael Rosen,An Update on US Intellectual Property Policy: Highlights from My Conversation with Michael Rosen,11
https://www.aei.org/podcast/an-update-on-the-global-intellectual-property-landscape-with-michael-rosen/,An Update on the Global Intellectual Property Landscape (with Michael Rosen),An Update on the Global Intellectual Property Landscape (with Michael Rosen),11
https://www.aei.org/technology-and-innovation/re-thinking-spectrum-sharing-to-enable-a-5g-future-highlights-from-my-conversation-with-peter-rysavy/,Re-Thinking Spectrum Sharing to Enable a 5G Future: Highlights from My Conversation with Peter Rysav...,Re-Thinking Spectrum Sharing to Enable a 5G Future: Highlights from My Conversation with Peter Rysavy,11
https://www.aei.org/podcast/re-thinking-spectrum-sharing-to-enable-a-5g-future-with-peter-rysavy/,Re-Thinking Spectrum Sharing to Enable a 5G Future (with Peter Rysavy),Re-Thinking Spectrum Sharing to Enable a 5G Future (with Peter Rysavy),11
https://www.aei.org/technology-and-innovation/whois-standoff-on-accuracy-accountability-and-access-to-data-continues/,"WHOIS Standoff on Accuracy, Accountability, and Access to Data Continues","WHOIS Standoff on Accuracy, Accountability, and Access to Data Continues",11
https://www.aei.org/technology-and-innovation/inside-a-cybersecurity-training-firm-highlights-from-my-conversation-with-keith-peer/,Inside a Cybersecurity Training Firm: Highlights from My Conversation with Keith Peer,Inside a Cybersecurity Training Firm: Highlights from My Conversation with Keith Peer,11
https://www.aei.org/podcast/a-look-inside-a-cybersecurity-training-firm-with-keith-peer/,A Look Inside a Cybersecurity Training Firm (with Keith Peer),A Look Inside a Cybersecurity Training Firm (with Keith Peer),11
https://www.aei.org/technology-and-innovation/the-state-of-our-nations-cybersecurity-highlights-from-my-conversation-with-michael-chertoff/,The State of Our Nation’s Cybersecurity: Highlights from My Conversation with Michael Chertoff,The State of Our Nation’s Cybersecurity: Highlights from My Conversation with Michael Chertoff,11
https://www.aei.org/events/what-would-happen-to-consumers-and-the-economy-under-a-progressive-regulatory-regime/,What Would Happen to Consumers and the Economy Under a Progressive Regulatory Regime?,What Would Happen to Consumers and the Economy Under a Progressive Regulatory Regime?,11
https://www.aei.org/podcast/the-state-of-our-nations-cybersecurity-with-michael-chertoff/,The State of Our Nation’s Cybersecurity (with Michael Chertoff),The State of Our Nation’s Cybersecurity (with Michael Chertoff),11
https://www.aei.org/technology-and-innovation/mandated-sideloading-remains-a-security-risk-and-bad-idea/,Mandated “Sideloading” Remains a Security Risk and Bad Idea,Mandated “Sideloading” Remains a Security Risk and Bad Idea,11
https://www.aei.org/technology-and-innovation/tech-policy-in-congress-and-the-european-union-highlights-from-my-conversation-with-peter-brown/,Tech Policy in Congress and the European Union: Highlights from My Conversation with Peter Brown,Tech Policy in Congress and the European Union: Highlights from My Conversation with Peter Brown,11
https://www.aei.org/podcast/can-the-us-and-europe-find-common-ground-on-tech-policy-with-peter-brown/,Can the US and Europe Find Common Ground on Tech Policy? (with Peter Brown),Can the US and Europe Find Common Ground on Tech Policy? (with Peter Brown),11
https://www.aei.org/technology-and-innovation/building-a-trusted-future-online-highlights-from-my-conversation-with-adam-golodner/,Building a “Trusted Future” Online: Highlights from My Conversation with Adam Golodner,Building a “Trusted Future” Online: Highlights from My Conversation with Adam Golodner,12
https://www.aei.org/technology-and-innovation/the-future-of-online-speech-regulation-and-section-230-highlights-from-an-expert-panel-discussion/,The Future of Online Speech Regulation and Section 230: Highlights from an Expert Panel Discussion,The Future of Online Speech Regulation and Section 230: Highlights from an Expert Panel Discussion,12
https://www.aei.org/technology-and-innovation/5g-planes-and-progress/,"5G, Planes, and Progress","5G, Planes, and Progress",12
https://www.aei.org/podcast/how-to-build-a-trusted-future-online-with-adam-golodner/,How to Build a ‘Trusted Future’ Online (with Adam Golodner),How to Build a ‘Trusted Future’ Online (with Adam Golodner),12
https://www.aei.org/op-eds/congress-is-putting-attacking-big-tech-ahead-of-protecting-americans/,Congress Is Putting Attacking Big Tech Ahead of Protecting Americans,Congress Is Putting Attacking Big Tech Ahead of Protecting Americans,12
https://www.aei.org/podcast/the-future-of-online-speech-regulation-section-230-and-beyond/,The Future of Online Speech Regulation: Section 230 and Beyond,The Future of Online Speech Regulation: Section 230 and Beyond,12
https://www.aei.org/op-eds/rural-broadband-requires-out-of-the-box-thinking/,Rural Broadband Requires Out-of-the-Box Thinking,Rural Broadband Requires Out-of-the-Box Thinking,12
https://www.aei.org/podcast/how-to-improve-mobile-device-security-with-kevin-mcnamee/,How to Improve Mobile-Device Security (with Kevin McNamee),How to Improve Mobile-Device Security (with Kevin McNamee),12
https://www.aei.org/technology-and-innovation/how-congress-could-make-your-smartphone-less-secure-highlights-from-my-conversation-with-patrick-hedger/,How Congress Could Make Your Smartphone Less Secure: Highlights from My Conversation with Patrick He...,How Congress Could Make Your Smartphone Less Secure: Highlights from My Conversation with Patrick Hedger,12
https://www.aei.org/events/the-future-of-online-speech-regulation-section-230-and-beyond/,The Future of Online Speech Regulation: Section 230 and Beyond,The Future of Online Speech Regulation: Section 230 and Beyond,12
https://www.aei.org/podcast/how-congress-could-make-your-smartphone-less-secure-with-patrick-hedger/,How Congress Could Make Your Smartphone Less Secure (with Patrick Hedger),How Congress Could Make Your Smartphone Less Secure (with Patrick Hedger),12
https://www.aei.org/technology-and-innovation/european-regulators-are-the-real-gatekeepers-in-the-new-digital-markets-act/,European Regulators Are the Real ‘Gatekeepers’ in the New Digital Markets Act,European Regulators Are the Real ‘Gatekeepers’ in the New Digital Markets Act,12
https://www.aei.org/technology-and-innovation/the-geopolitical-and-national-security-implications-of-computer-chips-highlights-from-a-conversation-with-chris-miller/,The Geopolitical and National Security Implications of Computer Chips: Highlights from a Conversatio...,The Geopolitical and National Security Implications of Computer Chips: Highlights from a Conversation with Chris Miller,12
https://www.aei.org/technology-and-innovation/is-shutting-down-the-russian-internet-an-act-of-tyranny-or-democracy-2/,Is Shutting Down the Russian Internet an Act of Tyranny or Democracy?,Is Shutting Down the Russian Internet an Act of Tyranny or Democracy?,12
https://www.aei.org/podcast/why-computer-chips-have-major-geopolitical-and-national-security-implications-with-chris-miller/,Why Computer Chips Have Major Geopolitical and National-Security Implications (with Chris Miller),Why Computer Chips Have Major Geopolitical and National-Security Implications (with Chris Miller),12
https://www.aei.org/technology-and-innovation/does-the-chip-industry-need-a-big-government-intervention-highlights-from-a-conversation-with-karl-wennberg/,Does the Chip Industry Need a Big-government Intervention? Highlights from a Conversation with Karl ...,Does the Chip Industry Need a Big-government Intervention? Highlights from a Conversation with Karl Wennberg,12
https://www.aei.org/podcast/does-the-chip-industry-need-a-boost-from-big-government-with-karl-wennberg/,Does the Chip Industry Need a Boost from Big Government? (with Karl Wennberg),Does the Chip Industry Need a Boost from Big Government? (with Karl Wennberg),12
https://www.aei.org/technology-and-innovation/non-fungible-tokens-an-explainer/,Non-fungible Tokens: An Explainer,Non-fungible Tokens: An Explainer,12
https://www.aei.org/technology-and-innovation/cell-towers-5g-and-americas-connected-future-highlights-from-my-conversation-with-todd-schlekeway/,"Cell Towers, 5G, and America’s Connected Future: Highlights from My Conversation with Todd Schlekewa...","Cell Towers, 5G, and America’s Connected Future: Highlights from My Conversation with Todd Schlekeway",12
https://www.aei.org/podcast/communications-infrastructure-and-americas-connected-future-with-todd-schlekeway/,Communications Infrastructure and America’s Connected Future (with Todd Schlekeway),Communications Infrastructure and America’s Connected Future (with Todd Schlekeway),12
https://www.aei.org/technology-and-innovation/this-valentines-day-protect-yourself-from-dating-app-scams/,"This Valentine’s Day, Protect Yourself from Dating App Scams","This Valentine’s Day, Protect Yourself from Dating App Scams",13
https://www.aei.org/technology-and-innovation/web3-and-the-future-of-the-internet-highlights-from-my-conversation-with-gabrielle-hibbert/,Web3 and the Future of the Internet: Highlights from My Conversation with Gabrielle Hibbert,Web3 and the Future of the Internet: Highlights from My Conversation with Gabrielle Hibbert,13
https://www.aei.org/technology-and-innovation/5g-wireless-is-finally-cleared-for-takeoff/,5G Wireless Is Finally Cleared for Takeoff,5G Wireless Is Finally Cleared for Takeoff,13
https://www.aei.org/podcast/what-will-the-next-generation-of-the-internet-look-like-with-gabrielle-hibbert/,What Will the Next Generation of the Internet Look Like? (with Gabrielle Hibbert),What Will the Next Generation of the Internet Look Like? (with Gabrielle Hibbert),13
https://www.aei.org/technology-and-innovation/a-breaking-point-for-tech-antitrust-highlights-from-my-conversation-with-matt-perault-and-blair-levin/,A Breaking Point for Tech Antitrust: Highlights from My Conversation with Matt Perault and Blair Lev...,A Breaking Point for Tech Antitrust: Highlights from My Conversation with Matt Perault and Blair Levin,13
https://www.aei.org/technology-and-innovation/would-joining-the-metaverse-make-walmart-a-tech-company/,Would Joining the Metaverse Make Walmart a Tech Company?,Would Joining the Metaverse Make Walmart a Tech Company?,13
https://www.aei.org/podcast/a-potential-breaking-point-for-tech-antitrust-with-matt-perault-and-blair-levin/,A Potential Breaking Point for Tech Antitrust (with Matt Perault and Blair Levin),A Potential Breaking Point for Tech Antitrust (with Matt Perault and Blair Levin),13
https://www.aei.org/technology-and-innovation/how-can-technology-help-the-supply-chain-highlights-from-my-conversation-with-glenn-richey/,How Can Technology Help the Supply Chain? Highlights from My Conversation with Glenn Richey,How Can Technology Help the Supply Chain? Highlights from My Conversation with Glenn Richey,13
https://www.aei.org/technology-and-innovation/the-complexities-of-online-content-moderation-highlights-from-my-conversation-with-julie-owono/,The Complexities of Online Content Moderation: Highlights from My Conversation with Julie Owono,The Complexities of Online Content Moderation: Highlights from My Conversation with Julie Owono,13
https://www.aei.org/podcast/can-technology-improve-supply-chain-management-with-glenn-richey/,Can Technology Improve Supply Chain Management? (with Glenn Richey),Can Technology Improve Supply Chain Management? (with Glenn Richey),13
https://www.aei.org/technology-and-innovation/top-5-podcasts-of-2021-explain-to-shane-with-shane-tews/,Top 5 Podcasts of 2021: ‘Explain to Shane’ with Shane Tews,Top 5 Podcasts of 2021: ‘Explain to Shane’ with Shane Tews,13
https://www.aei.org/technology-and-innovation/technology-policy-at-aei-2021-highlights-2022-predictions/,"Technology Policy at AEI: 2021 Highlights, 2022 Predictions","Technology Policy at AEI: 2021 Highlights, 2022 Predictions",13
https://www.aei.org/podcast/unpacking-the-complexities-of-online-content-moderation-with-julie-owono/,Unpacking the Complexities of Online Content Moderation (with Julie Owono),Unpacking the Complexities of Online Content Moderation (with Julie Owono),13
https://www.aei.org/technology-and-innovation/how-is-cybersecurity-law-being-constructed-highlights-from-my-conversation-with-jim-dempsey/,How Is Cybersecurity Law Being Constructed? Highlights from My Conversation with Jim Dempsey,How Is Cybersecurity Law Being Constructed? Highlights from My Conversation with Jim Dempsey,13
https://www.aei.org/op-eds/biden-must-defend-democracy-against-rising-authoritarianism/,Biden Must Defend Democracy Against Rising Authoritarianism,Biden Must Defend Democracy Against Rising Authoritarianism,13
https://www.aei.org/podcast/how-is-cybersecurity-law-being-constructed-with-jim-dempsey/,How Is Cybersecurity Law Being Constructed? (with Jim Dempsey),How Is Cybersecurity Law Being Constructed? (with Jim Dempsey),13
https://www.aei.org/technology-and-innovation/answering-the-paris-call-an-important-step-for-us-cybersecurity-leadership/,Answering the Paris Call: An Important Step for US Cybersecurity Leadership,Answering the Paris Call: An Important Step for US Cybersecurity Leadership,13
https://www.aei.org/technology-and-innovation/a-privacy-friendly-digital-wallet-for-children-highlights-from-my-conversation-with-rick-lane/,A Privacy-friendly Digital Wallet for Children: Highlights from My Conversation with Rick Lane,A Privacy-friendly Digital Wallet for Children: Highlights from My Conversation with Rick Lane,13
https://www.aei.org/technology-and-innovation/a-spectrum-roadblock-for-the-wireless-industry-highlights-from-my-conversation-with-mike-orielly-and-harold-feld/,A Spectrum Roadblock for the Wireless Industry: Highlights from My Conversation with Mike O’Rielly a...,A Spectrum Roadblock for the Wireless Industry: Highlights from My Conversation with Mike O’Rielly and Harold Feld,13
https://www.aei.org/podcast/a-privacy-friendly-digital-wallet-for-children-with-rick-lane/,A Privacy-Friendly Digital Wallet for Children (with Rick Lane),A Privacy-Friendly Digital Wallet for Children (with Rick Lane),13
https://www.aei.org/podcast/a-spectrum-roadblock-for-the-wireless-industry-with-mike-orielly-and-harold-feld/,A Spectrum Roadblock for the Wireless Industry (with Mike O’Rielly and Harold Feld),A Spectrum Roadblock for the Wireless Industry (with Mike O’Rielly and Harold Feld),14
https://www.aei.org/technology-and-innovation/cybersecurity-in-agriculture-dont-forget-about-mobile/,Cybersecurity in Agriculture: Don’t Forget About Mobile,Cybersecurity in Agriculture: Don’t Forget About Mobile,14
https://www.aei.org/technology-and-innovation/the-past-present-and-future-of-section-230-highlights-from-my-conversation-with-former-rep-chris-cox-r-ca/,"The Past, Present, and Future of Section 230: Highlights from My Conversation with Former Rep. Chris...","The Past, Present, and Future of Section 230: Highlights from My Conversation with Former Rep. Chris Cox (R-CA)",14
https://www.aei.org/podcast/a-co-author-of-section-230-on-the-laws-past-present-and-future-with-former-rep-chris-cox/,"A Co-author of Section 230 on the Law’s Past, Present, and Future (with Former Rep. Chris Cox)","A Co-author of Section 230 on the Law’s Past, Present, and Future (with Former Rep. Chris Cox)",14
https://www.aei.org/technology-and-innovation/does-the-us-need-a-national-cybersecurity-strategy-highlights-from-an-expert-panel-discussion/,Does the US Need a National Cybersecurity Strategy? Highlights from an Expert Panel Discussion,Does the US Need a National Cybersecurity Strategy? Highlights from an Expert Panel Discussion,14
https://www.aei.org/technology-and-innovation/the-fcc-takes-key-steps-toward-securing-us-tech-infrastructure/,The FCC Takes Key Steps Toward Securing US Tech Infrastructure,The FCC Takes Key Steps Toward Securing US Tech Infrastructure,14
https://www.aei.org/technology-and-innovation/congress-skirmish-with-big-tech-highlights-from-a-conversation-with-jennifer-huddleston/,Congress’ Skirmish with Big Tech: Highlights from a Conversation with Jennifer Huddleston,Congress’ Skirmish with Big Tech: Highlights from a Conversation with Jennifer Huddleston,14
https://www.aei.org/events/does-the-us-need-a-national-cybersecurity-strategy/,Does the US Need a National Cybersecurity Strategy?,Does the US Need a National Cybersecurity Strategy?,14
https://www.aei.org/podcast/analyzing-congress-skirmish-with-big-tech-with-jennifer-huddleston/,Analyzing Congress’ Skirmish with Big Tech (with Jennifer Huddleston),Analyzing Congress’ Skirmish with Big Tech (with Jennifer Huddleston),14
https://www.aei.org/technology-and-innovation/whats-going-on-at-the-federal-trade-commission-highlights-from-a-conversation-with-bilal-sayyed/,What’s Going on at the Federal Trade Commission? Highlights from a Conversation with Bilal Sayyed,What’s Going on at the Federal Trade Commission? Highlights from a Conversation with Bilal Sayyed,14
https://www.aei.org/technology-and-innovation/the-dangers-of-lawmakers-contradiction-and-confusion-on-big-tech/,The Dangers of Lawmakers’ Contradiction and Confusion on Big Tech,The Dangers of Lawmakers’ Contradiction and Confusion on Big Tech,14
https://www.aei.org/podcast/whats-going-on-at-the-federal-trade-commission-with-bilal-sayyed-part-ii/,What’s Going On at the Federal Trade Commission? (with Bilal Sayyed—Part II),What’s Going On at the Federal Trade Commission? (with Bilal Sayyed—Part II),14
https://www.aei.org/technology-and-innovation/progress-on-us-leadership-in-next-generation-networks-highlights-from-a-conversation-with-fcc-commissioner-brendan-carr/,Progress on US Leadership in Next-generation Networks: Highlights from a Conversation with FCC Commi...,Progress on US Leadership in Next-generation Networks: Highlights from a Conversation with FCC Commissioner Brendan Carr,14
https://www.aei.org/podcast/whats-going-on-at-the-federal-trade-commission-with-bilal-sayyed-part-i/,What’s Going On at the Federal Trade Commission? (with Bilal Sayyed—Part I),What’s Going On at the Federal Trade Commission? (with Bilal Sayyed—Part I),14
https://www.aei.org/technology-and-innovation/an-argument-for-section-230-reform-highlights-from-my-conversation-with-neil-fried/,An Argument for Section 230 Reform: Highlights from My Conversation with Neil Fried,An Argument for Section 230 Reform: Highlights from My Conversation with Neil Fried,14
https://www.aei.org/op-eds/steering-the-transatlantic-partnership-toward-innovation/,Steering the Transatlantic Partnership Toward Innovation,Steering the Transatlantic Partnership Toward Innovation,14
https://www.aei.org/podcast/should-section-230-be-reformed-with-neil-fried/,Should Section 230 Be Reformed? (with Neil Fried),Should Section 230 Be Reformed? (with Neil Fried),14
https://www.aei.org/events/fcc-commissioner-brendan-carr-a-progress-report-on-us-leadership-in-next-generation-networks/,FCC Commissioner Brendan Carr: A Progress Report on US Leadership in Next-generation Networks,FCC Commissioner Brendan Carr: A Progress Report on US Leadership in Next-generation Networks,14
https://www.aei.org/technology-and-innovation/are-privacy-laws-compatible-with-international-trade-highlights-from-my-conversation-with-nigel-cory/,Are Privacy Laws Compatible with International Trade? Highlights from My Conversation with Nigel Cor...,Are Privacy Laws Compatible with International Trade? Highlights from My Conversation with Nigel Cory,14
https://www.aei.org/technology-and-innovation/lessons-learned-from-the-governments-failure-to-understand-technologys-power/,Lessons Learned from the Government’s Failure to Understand Technology’s Power,Lessons Learned from the Government’s Failure to Understand Technology’s Power,14
https://www.aei.org/podcast/how-data-privacy-laws-have-upended-international-trade-with-nigel-cory/,How Data Privacy Laws Have Upended International Trade (with Nigel Cory),How Data Privacy Laws Have Upended International Trade (with Nigel Cory),15
https://www.aei.org/technology-and-innovation/how-tech-firms-are-managing-the-challenges-of-todays-market-highlights-from-my-conversation-with-john-godfrey/,How Tech Firms Are Managing the Challenges of Today’s Market: Highlights from My Conversation with J...,How Tech Firms Are Managing the Challenges of Today’s Market: Highlights from My Conversation with John Godfrey,15
https://www.aei.org/op-eds/mobile-security-risks-are-at-an-all-time-high/,Mobile Security Risks Are at an All-Time High.,Mobile Security Risks Are at an All-Time High.,15
https://www.aei.org/podcast/how-are-tech-firms-weathering-the-challenges-of-todays-market-with-john-godfrey/,How Are Tech Firms Weathering the Challenges of Today’s Market? (with John Godfrey),How Are Tech Firms Weathering the Challenges of Today’s Market? (with John Godfrey),15
https://www.aei.org/technology-and-innovation/the-splinternet-and-online-security-highlights-from-my-conversation-with-nick-merrill/,The ‘Splinternet’ and Online Security: Highlights from My Conversation with Nick Merrill,The ‘Splinternet’ and Online Security: Highlights from My Conversation with Nick Merrill,15
https://www.aei.org/podcast/understanding-the-splinternet-and-online-security-with-nick-merrill/,Understanding the ‘Splinternet’ and Online Security (with Nick Merrill),Understanding the ‘Splinternet’ and Online Security (with Nick Merrill),15
https://www.aei.org/technology-and-innovation/right-to-repair-could-be-a-trojan-horse-for-chaos/,“Right to Repair” Could Be a Trojan Horse for Chaos,“Right to Repair” Could Be a Trojan Horse for Chaos,15
https://www.aei.org/technology-and-innovation/how-to-engineer-better-data-governance-highlights-from-my-conversation-with-nishant-bhajaria/,How to Engineer Better Data Governance: Highlights from My Conversation with Nishant Bhajaria,How to Engineer Better Data Governance: Highlights from My Conversation with Nishant Bhajaria,15
