url,link_text,post_title,page
https://www.aei.org/op-eds/if-the-u-s-doesnt-set-global-tech-standards-china-will/,"If the U.S. Doesn’t Set Global Tech Standards, China Will","If the U.S. Doesn’t Set Global Tech Standards, China Will",1
https://www.aei.org/technology-and-innovation/breaking-language-barriers-through-multilingual-domains/,Breaking Language Barriers Through Multilingual Domains,Breaking Language Barriers Through Multilingual Domains,1
https://www.aei.org/technology-and-innovation/ai-in-the-cyber-trenches-the-next-frontier-for-critical-infrastructure-security/,Securing Critical Infrastructure in the Age of AI,Securing Critical Infrastructure in the Age of AI,1
https://www.aei.org/multimedia/inside-the-world-of-domains-with-ram-mohan/,Inside the World of Domains (with Ram Mohan),Inside the World of Domains (with Ram Mohan),1
https://www.aei.org/technology-and-innovation/spectrum-at-a-crossroads/,Spectrum at a Crossroads,Spectrum at a Crossroads,1
https://www.aei.org/technology-and-innovation/data-security-and-liberty-whats-at-stake-in-federal-consolidation/,"Data, Security, and Liberty: What’s at Stake in Federal Consolidation?","Data, Security, and Liberty: What’s at Stake in Federal Consolidation?",1
https://www.aei.org/technology-and-innovation/the-tea-app-breach-shows-why-we-cant-regulate-for-openness-without-planning-for-security/,The Tea App Breach Shows Why We Can’t Regulate for Openness Without Planning for Security,The Tea App Breach Shows Why We Can’t Regulate for Openness Without Planning for Security,1
https://www.aei.org/multimedia/reclaiming-the-airwaves-with-harold-furchtgott-roth/,Reclaiming the Airwaves (with Harold Furchtgott-Roth),Reclaiming the Airwaves (with Harold Furchtgott-Roth),1
https://www.aei.org/technology-and-innovation/how-the-ai-era-is-changing-the-way-we-learn-and-work/,How the AI Era Is Changing the Way We Learn and Work,How the AI Era Is Changing the Way We Learn and Work,1
https://www.aei.org/events/federal-data-consolidation-protecting-civil-liberties-in-the-digital-age/,Federal Data Consolidation: Protecting Civil Liberties in the Digital Age,Federal Data Consolidation: Protecting Civil Liberties in the Digital Age,1
https://www.aei.org/multimedia/adapting-to-the-ai-era-with-bojan-tunguz-and-brent-orrell/,Adapting to the AI Era (with Bojan Tunguz and Brent Orrell),Adapting to the AI Era (with Bojan Tunguz and Brent Orrell),1
https://www.aei.org/events/free-speech-and-tech-policy-at-the-us-supreme-court-2025/,"Free Speech and Tech Policy at the US Supreme Court, 2025","Free Speech and Tech Policy at the US Supreme Court, 2025",1
https://www.aei.org/technology-and-innovation/how-the-vatican-is-shaping-the-ethics-of-artificial-intelligence/,How the Vatican Is Shaping the Ethics of Artificial Intelligence,How the Vatican Is Shaping the Ethics of Artificial Intelligence,1
https://www.aei.org/technology-and-innovation/the-open-app-markets-act-how-competition-reform-would-open-americas-digital-doors-to-hackers-and-foreign-adversaries/,The Open App Markets Act: How “Competition” Reform Would Open America’s Digital Doors to Hackers and...,The Open App Markets Act: How “Competition” Reform Would Open America’s Digital Doors to Hackers and Foreign Adversaries,1
https://www.aei.org/multimedia/ai-governments-and-god-with-father-paolo-benanti/,"AI, Governments, and God (with Father Paolo Benanti)","AI, Governments, and God (with Father Paolo Benanti)",1
https://www.aei.org/technology-and-innovation/how-the-fcc-space-bureau-is-rethinking-the-rules-of-space/,How the FCC Space Bureau is Rethinking the Rules of Space,How the FCC Space Bureau is Rethinking the Rules of Space,1
https://www.aei.org/technology-and-innovation/why-america-cannot-afford-to-wait-anymore-the-need-for-spectrum-auction-reauthorization/,Why America Cannot Afford to Wait Anymore: The Need for Spectrum Auction Reauthorization,Why America Cannot Afford to Wait Anymore: The Need for Spectrum Auction Reauthorization,1
https://www.aei.org/multimedia/rethinking-the-rules-of-space-with-jay-schwarz/,Rethinking the Rules of Space (with Jay Schwarz),Rethinking the Rules of Space (with Jay Schwarz),1
https://www.aei.org/technology-and-innovation/how-meta-thinks-about-personalization-and-privacy/,How Meta Thinks About Personalization and Privacy,How Meta Thinks About Personalization and Privacy,1
https://www.aei.org/technology-and-innovation/congressional-crossfire-how-competing-app-store-bills-create-an-impossible-mandate/,Congressional Crossfire: How Competing App Store Bills Create an Impossible Mandate,Congressional Crossfire: How Competing App Store Bills Create an Impossible Mandate,1
https://www.aei.org/multimedia/personalization-privacy-and-policy-with-rob-sherman/,"Personalization, Privacy, and Policy (with Rob Sherman)","Personalization, Privacy, and Policy (with Rob Sherman)",2
https://www.aei.org/technology-and-innovation/redrawing-the-map-how-legal-decisions-and-trade-policies-are-transforming-our-tech-ecosystem/,Redrawing the Map: How Legal Decisions and Trade Policies Are Transforming Our Tech Ecosystem,Redrawing the Map: How Legal Decisions and Trade Policies Are Transforming Our Tech Ecosystem,2
https://www.aei.org/technology-and-innovation/the-digital-markets-act-a-security-risk-for-encrypted-communications/,The Digital Markets Act: A Security Risk for Encrypted Communications,The Digital Markets Act: A Security Risk for Encrypted Communications,2
https://www.aei.org/technology-and-innovation/the-dangerous-road-to-a-master-file-why-linking-government-databases-is-a-terrible-idea/,The Dangerous Road to a “Master File”—Why Linking Government Databases Is a Terrible Idea,The Dangerous Road to a “Master File”—Why Linking Government Databases Is a Terrible Idea,2
https://www.aei.org/technology-and-innovation/the-spectrum-exchange-networks-security-and-innovation-highlights-from-my-conversation-with-peter-rysavy/,"The Spectrum Exchange: Networks, Security, and Innovation","The Spectrum Exchange: Networks, Security, and Innovation",2
https://www.aei.org/events/ai-and-jobs-measuring-impact-and-building-new-assessment-tools/,AI and Jobs: Measuring Impact and Building New Assessment Tools,AI and Jobs: Measuring Impact and Building New Assessment Tools,2
https://www.aei.org/technology-and-innovation/childrens-online-safety-should-rely-on-content-providers-not-device-manufacturers/,"Children’s Online Safety Should Rely on Content Providers, Not Device Manufacturers","Children’s Online Safety Should Rely on Content Providers, Not Device Manufacturers",2
https://www.aei.org/multimedia/the-spectrum-exchange-networks-security-and-innovation-with-peter-rysavy/,"The Spectrum Exchange: Networks, Security, and Innovation (with Peter Rysavy)","The Spectrum Exchange: Networks, Security, and Innovation (with Peter Rysavy)",2
https://www.aei.org/technology-and-innovation/rebuilding-the-transatlantic-tech-alliance-why-innovation-not-regulation-should-guide-the-way/,"Rebuilding the Transatlantic Tech Alliance: Why Innovation, Not Regulation, Should Guide the Way","Rebuilding the Transatlantic Tech Alliance: Why Innovation, Not Regulation, Should Guide the Way",2
https://www.aei.org/uncategorized/the-future-of-the-enterprise-browser-highlights-from-my-conversation-with-scott-montgomery/,The Future of the Enterprise Browser: Highlights from My Conversation with Scott Montgomery,The Future of the Enterprise Browser: Highlights from My Conversation with Scott Montgomery,2
https://www.aei.org/op-eds/global-encryption-under-siege-how-uks-apple-backdoor-demand-threatens-international-security/,Global Encryption Under Siege: How UK’s Apple Backdoor Demand Threatens International Security,Global Encryption Under Siege: How UK’s Apple Backdoor Demand Threatens International Security,2
https://www.aei.org/multimedia/the-future-of-the-enterprise-browser/,The Future of the Enterprise Browser,The Future of the Enterprise Browser,2
https://www.aei.org/technology-and-innovation/the-critical-role-of-administration-officials-in-americas-ai-future/,The Critical Role of Administration Officials in America’s AI Future,The Critical Role of Administration Officials in America’s AI Future,2
https://www.aei.org/technology-and-innovation/taking-on-government-bureaucracy-with-shane-bigelow/,Taking On Government Bureaucracy (with Shane Bigelow),Taking On Government Bureaucracy (with Shane Bigelow),2
https://www.aei.org/technology-and-innovation/age-verification-laws-vs-parental-controls-why-the-legislatures-courts-and-tech-arent-on-the-same-page/,"Age Verification Laws vs. Parental Controls: Why the Legislatures, Courts, and Tech Aren’t on the Sa...","Age Verification Laws vs. Parental Controls: Why the Legislatures, Courts, and Tech Aren’t on the Same Page",2
https://www.aei.org/multimedia/taking-on-dmv-bureaucracy-with-shane-bigelow/,Taking on DMV Bureaucracy (with Shane Bigelow),Taking on DMV Bureaucracy (with Shane Bigelow),2
https://www.aei.org/technology-and-innovation/the-wearable-revolution-transforming-health-care-with-ai-driven-insights/,The Wearable Revolution: Transforming Health Care with AI-Driven Insights,The Wearable Revolution: Transforming Health Care with AI-Driven Insights,2
https://www.aei.org/technology-and-innovation/the-digital-markets-act-security-and-innovation-challenges-in-tech-regulation/,The Digital Markets Act: Security and Innovation Challenges in Tech Regulation,The Digital Markets Act: Security and Innovation Challenges in Tech Regulation,2
https://www.aei.org/technology-and-innovation/open-insights/protecting-youth-online-a-guide-to-parental-controls-and-safety-tools/,Protecting Youth Online: A Guide to Parental Controls and Safety Tools,Protecting Youth Online: A Guide to Parental Controls and Safety Tools,2
https://www.aei.org/technology-and-innovation/navigating-indias-digital-competition-landscape-wp-post/,Navigating India’s Digital Competition Landscape,Navigating India’s Digital Competition Landscape,2
https://www.aei.org/multimedia/the-fight-against-drug-shortages-with-laura-bray/,The Fight Against Drug Shortages (with Laura Bray),The Fight Against Drug Shortages (with Laura Bray),3
https://www.aei.org/technology-and-innovation/why-encryption-matters-more-than-ever/,Why Encryption Matters More Than Ever,Why Encryption Matters More Than Ever,3
https://www.aei.org/multimedia/navigating-indias-digital-competition-landscape-with-shruti-rajagopalan-and-shreyas-narla/,Navigating India’s Digital Competition Landscape (with Shruti Rajagopalan and Shreyas Narla),Navigating India’s Digital Competition Landscape (with Shruti Rajagopalan and Shreyas Narla),3
https://www.aei.org/technology-and-innovation/ai-and-the-future-of-civics-highlights-post/,AI and the Future of Civics,AI and the Future of Civics,3
https://www.aei.org/multimedia/ai-and-the-future-of-civics-with-adam-hinds-michael-champigny-and-will-foster-nolan/,"AI and the Future of Civics (with Adam Hinds, Michael Champigny, and Will Foster-Nolan)","AI and the Future of Civics (with Adam Hinds, Michael Champigny, and Will Foster-Nolan)",3
https://www.aei.org/technology-and-innovation/the-power-of-pivots-how-smart-companies-change-the-game/,The Power of Pivots: How Smart Companies Change the Game,The Power of Pivots: How Smart Companies Change the Game,3
https://www.aei.org/technology-and-innovation/between-rules-and-reality-the-complex-challenge-of-eu-data-compliance/,Between Rules and Reality: The Complex Challenge of EU Data Compliance,Between Rules and Reality: The Complex Challenge of EU Data Compliance,3
https://www.aei.org/multimedia/the-power-of-pivots-how-smart-companies-change-the-game-with-gary-shapiro/,The Power of Pivots: How Smart Companies Change the Game (with Gary Shapiro),The Power of Pivots: How Smart Companies Change the Game (with Gary Shapiro),3
https://www.aei.org/technology-and-innovation/cybersecurity-concerns-with-qr-codes-staying-safe-in-the-digital-age/,Cybersecurity Concerns with QR Codes: Staying Safe in the Digital Age,Cybersecurity Concerns with QR Codes: Staying Safe in the Digital Age,3
https://www.aei.org/technology-and-innovation/shane-tews-anthony-matos-the-future-of-small-business-financing/,The Future of Small Business Financing,The Future of Small Business Financing,3
https://www.aei.org/technology-and-innovation/the-critical-importance-of-encryption-for-consumers-lessons-from-recent-events/,The Vital Importance of Encryption for Consumers: Lessons from Recent Events,The Vital Importance of Encryption for Consumers: Lessons from Recent Events,3
https://www.aei.org/multimedia/the-future-of-small-business-financing/,The Future of Small Business Financing (with Anthony Matos),The Future of Small Business Financing (with Anthony Matos),3
https://www.aei.org/technology-and-innovation/the-broadband-dilemma/,The Broadband Dilemma,The Broadband Dilemma,3
https://www.aei.org/multimedia/the-broadband-dilemma-with-janice-hauge-and-mark-jamison/,The Broadband Dilemma (with Janice Hauge and Mark Jamison),The Broadband Dilemma (with Janice Hauge and Mark Jamison),3
https://www.aei.org/technology-and-innovation/apples-tax-triumph-turned-sour-is-the-eu-playing-fair/,Apple’s Tax Triumph Turned Sour: Is the EU Playing Fair?,Apple’s Tax Triumph Turned Sour: Is the EU Playing Fair?,3
https://www.aei.org/events/jawboning-weighing-government-influence-over-online-platforms-censorship-practices/,Jawboning: Weighing Government Influence over Online Platforms’ Censorship Practices,Jawboning: Weighing Government Influence over Online Platforms’ Censorship Practices,3
https://www.aei.org/technology-and-innovation/ais-corporate-takeover/,AI’s Corporate Takeover?,AI’s Corporate Takeover?,3
https://www.aei.org/technology-and-innovation/uks-ai-policy-pivot-from-global-ai-safety-leader-to-domestic-ai-adopter/,The UK’s AI Policy Pivot: From Global AI Safety Leader to Domestic AI Adopter?,The UK’s AI Policy Pivot: From Global AI Safety Leader to Domestic AI Adopter?,3
https://www.aei.org/multimedia/ais-corporate-takeover-with-mark-johnson/,AI’s Corporate Takeover? (With Mark Johnson),AI’s Corporate Takeover? (With Mark Johnson),3
https://www.aei.org/technology-and-innovation/can-we-childproof-the-internet/,Can We Childproof the Internet?,Can We Childproof the Internet?,3
https://www.aei.org/technology-and-innovation/the-hidden-danger-of-security-code-debt-why-thorough-vetting-is-crucial-before-deployment/,The Hidden Danger of Security Code Debt: Why Thorough Vetting Is Crucial Before Deployment,The Hidden Danger of Security Code Debt: Why Thorough Vetting Is Crucial Before Deployment,4
https://www.aei.org/multimedia/can-we-childproof-the-internet-with-ari-cohn/,Can We Childproof the Internet? (with Ari Cohn),Can We Childproof the Internet? (with Ari Cohn),4
https://www.aei.org/technology-and-innovation/renewing-the-partnership-between-government-and-entrepreneurs/,Renewing the Partnership Between Government and Entrepreneurs,Renewing the Partnership Between Government and Entrepreneurs,4
https://www.aei.org/multimedia/renewing-the-partnership-between-government-and-entrepreneurs-with-arun-gupta/,Renewing the Partnership Between Government and Entrepreneurs (with Arun Gupta),Renewing the Partnership Between Government and Entrepreneurs (with Arun Gupta),4
https://www.aei.org/technology-and-innovation/raising-the-bar-not-lowering-our-guard-around-cybersecurity/,"Raising the Bar, Not Lowering Our Guard, Around Cybersecurity","Raising the Bar, Not Lowering Our Guard, Around Cybersecurity",4
https://www.aei.org/events/free-speech-supreme-court-rulings-and-the-future-of-digital-discourse/,Free Speech Supreme Court Rulings and the Future of Digital Discourse,Free Speech Supreme Court Rulings and the Future of Digital Discourse,4
https://www.aei.org/technology-and-innovation/unpacking-the-data-dilemma/,Unpacking the Data Dilemma,Unpacking the Data Dilemma,4
https://www.aei.org/technology-and-innovation/busting-tech-myths/,Busting Tech Myths,Busting Tech Myths,4
https://www.aei.org/multimedia/unpacking-the-data-dilemma/,Unpacking the Data Dilemma (with Cristina Alaimo and Jannis Kallinikos),Unpacking the Data Dilemma (with Cristina Alaimo and Jannis Kallinikos),4
https://www.aei.org/technology-and-innovation/the-challenges-of-age-prediction-where-current-technology-falls-short/,The Challenges of Age-Prediction: Where Current Technology Falls Short,The Challenges of Age-Prediction: Where Current Technology Falls Short,4
https://www.aei.org/technology-and-innovation/securing-the-web-with-route-origin-authorizations/,Securing the Web with Route Origin Authorizations,Securing the Web with Route Origin Authorizations,4
https://www.aei.org/multimedia/busting-tech-myths-with-robert-atkinson-and-david-moschella/,Busting Tech Myths (with Robert Atkinson and David Moschella),Busting Tech Myths (with Robert Atkinson and David Moschella),4
https://www.aei.org/technology-and-innovation/the-ai-arms-race-apple-and-openais-partnership-raises-the-bar-for-privacy-and-a-more-secure-user-experience/,The AI Arms Race: Apple and OpenAI’s Partnership Raises the Bar for Privacy and a More Secure User E...,The AI Arms Race: Apple and OpenAI’s Partnership Raises the Bar for Privacy and a More Secure User Experience,4
https://www.aei.org/multimedia/securing-the-web-with-border-gateway-protocols-with-grace-abuhamad-and-robert-cannon/,Securing the Web with Route Origin Authorizations (with Grace Abuhamad and Robert Cannon),Securing the Web with Route Origin Authorizations (with Grace Abuhamad and Robert Cannon),4
https://www.aei.org/events/securing-ai-deployment-balancing-safety-and-benefits/,Securing AI Deployment: Balancing Safety and Benefits,Securing AI Deployment: Balancing Safety and Benefits,4
https://www.aei.org/technology-and-innovation/inside-techs-2-trillion-technical-debt/,Inside Tech’s $2 Trillion Technical Debt,Inside Tech’s $2 Trillion Technical Debt,4
https://www.aei.org/technology-and-innovation/how-crypto-cuts-through-red-tape/,How Crypto Cuts Through Red Tape,How Crypto Cuts Through Red Tape,4
https://www.aei.org/multimedia/inside-techs-2-trillion-technical-debt-with-ken-silva/,Inside Tech’s $2 Trillion Technical Debt (with Ken Silva),Inside Tech’s $2 Trillion Technical Debt (with Ken Silva),4
https://www.aei.org/technology-and-innovation/building-trust-in-ai-the-crucial-role-of-education-and-partnerships/,Building Trust in AI: The Crucial Role of Education and Partnerships,Building Trust in AI: The Crucial Role of Education and Partnerships,4
https://www.aei.org/multimedia/borderless-banking-how-crypto-cuts-through-red-tape-with-candace-kelly/,Borderless Banking: How Crypto Cuts Through Red Tape (with Candace Kelly),Borderless Banking: How Crypto Cuts Through Red Tape (with Candace Kelly),4
https://www.aei.org/technology-and-innovation/examine-the-fccs-proposal-on-bulk-billing-a-call-to-protect-consumer-interests/,Examine the FCC’s Proposal on Bulk Billing: A Call to Protect Consumer Interests,Examine the FCC’s Proposal on Bulk Billing: A Call to Protect Consumer Interests,5
https://www.aei.org/multimedia/defending-the-digital-realm-with-jason-hogg/,Defending the Digital Realm (with Jason Hogg),Defending the Digital Realm (with Jason Hogg),5
https://www.aei.org/technology-and-innovation/why-saving-am-radio-is-redundant-in-the-age-of-modern-technology/,Why Saving AM Radio Is Redundant in the Age of Modern Technology,Why Saving AM Radio Is Redundant in the Age of Modern Technology,5
https://www.aei.org/multimedia/global-connectivity-unplugged-with-brian-barrit-and-michael-cheng/,Global Connectivity Unplugged (with Brian Barritt and Michael Cheng),Global Connectivity Unplugged (with Brian Barritt and Michael Cheng),5
https://www.aei.org/technology-and-innovation/the-myth-of-net-neutrality-and-the-reality-of-network-management/,The Myth of Net Neutrality and the Reality of Network Management,The Myth of Net Neutrality and the Reality of Network Management,5
https://www.aei.org/uncategorized/the-digital-markets-act-balancing-innovation-and-consumer-safety-in-the-app-ecosystem/,The Digital Markets Act: Balancing Innovation and Consumer Safety in the App Ecosystem,The Digital Markets Act: Balancing Innovation and Consumer Safety in the App Ecosystem,5
https://www.aei.org/multimedia/what-has-been-done-to-address-online-lag-with-jason-livingood/,What Has Been Done to Address Online Lag? (with Jason Livingood),What Has Been Done to Address Online Lag? (with Jason Livingood),5
https://www.aei.org/technology-and-innovation/inside-the-challenge-against-phone-spam/,Inside the Challenge Against Phone Spam,Inside the Challenge Against Phone Spam,5
https://www.aei.org/multimedia/what-do-the-eus-tech-regulations-mean-for-the-us-with-james-lewis/,What Do the EU’s Tech Regulations Mean for the US? (With James Lewis),What Do the EU’s Tech Regulations Mean for the US? (With James Lewis),5
https://www.aei.org/articles/navigating-the-data-security-and-privacy-tightrope-balancing-the-biden-administration-and-european-rules-on-tech/,Navigating the Data Security and Privacy Tightrope: Balancing the Biden Administration and European ...,Navigating the Data Security and Privacy Tightrope: Balancing the Biden Administration and European Rules on Tech,5
https://www.aei.org/technology-and-innovation/making-sense-of-music-streaming/,Making Sense of Music Streaming,Making Sense of Music Streaming,5
https://www.aei.org/multimedia/inside-the-challenge-against-phone-spam-with-dave-stewart/,Inside the Challenge Against Phone Spam (with Dave Stewart),Inside the Challenge Against Phone Spam (with Dave Stewart),5
https://www.aei.org/technology-and-innovation/the-eu-rules-risk-smartphone-security/,The EU Rules Risk Smartphone Security,The EU Rules Risk Smartphone Security,5
https://www.aei.org/technology-and-innovation/navigating-the-post-world-radiocommunication-conference/,Navigating the Post–World Radiocommunication Conference,Navigating the Post–World Radiocommunication Conference,5
https://www.aei.org/multimedia/making-sense-of-music-streaming/,Making Sense of Music Streaming (with Michael Huppe),Making Sense of Music Streaming (with Michael Huppe),5
https://www.aei.org/research-products/testimony/testimony-leveraging-artificial-intelligence-to-enhance-veterans-affairs-services/,Testimony: Leveraging Artificial Intelligence to Enhance Veterans Affairs Services,Testimony: Leveraging Artificial Intelligence to Enhance Veterans Affairs Services,5
https://www.aei.org/technology-and-innovation/beyond-bitcoin-unlocking-blockchains-potential/,Beyond Bitcoin: Unlocking Blockchain’s Potential,Beyond Bitcoin: Unlocking Blockchain’s Potential,5
https://www.aei.org/technology-and-innovation/sustainability-highlighted-at-consumer-electronics-show-2024/,Sustainability Highlighted at Consumer Electronics Show 2024,Sustainability Highlighted at Consumer Electronics Show 2024,5
https://www.aei.org/events/navigating-the-post-world-radiocommunication-conference-outlook-for-wireless-innovation/,Navigating the Post–World Radiocommunication Conference Outlook for Wireless Innovation,Navigating the Post–World Radiocommunication Conference Outlook for Wireless Innovation,5
https://www.aei.org/multimedia/beyond-bitcoin-with-yuval-rooz/,Beyond Bitcoin (with Yuval Rooz),Beyond Bitcoin (with Yuval Rooz),5
https://www.aei.org/technology-and-innovation/examining-manipulated-media-and-platform-accountability/,Examining Manipulated Media and Platform Accountability,Examining Manipulated Media and Platform Accountability,6
https://www.aei.org/technology-and-innovation/keeping-kids-safe-online-requires-shared-responsibility/,Keeping Kids Safe Online Requires Shared Responsibility,Keeping Kids Safe Online Requires Shared Responsibility,6
https://www.aei.org/technology-and-innovation/the-paperless-revolution/,The Paperless Revolution,The Paperless Revolution,6
https://www.aei.org/technology-and-innovation/quantum-computings-next-wave/,Quantum: Computing’s Next Wave,Quantum: Computing’s Next Wave,6
https://www.aei.org/technology-and-innovation/exploring-the-federal-communications-commissions-challenges-in-5g-leadership/,Exploring the Federal Communications Commission’s Challenges in 5G Leadership,Exploring the Federal Communications Commission’s Challenges in 5G Leadership,6
https://www.aei.org/technology-and-innovation/how-ai-is-rewriting-political-advertising/,How AI Is Rewriting Political Advertising,How AI Is Rewriting Political Advertising,6
https://www.aei.org/technology-and-innovation/eu-sharpens-its-teeth-how-regulatory-fines-on-american-tech-firms-are-harming-competition/,The EU Sharpens Its Teeth: How Regulatory Fines on American Tech Firms Are Harming Competition,The EU Sharpens Its Teeth: How Regulatory Fines on American Tech Firms Are Harming Competition,6
https://www.aei.org/multimedia/candidates-bots-and-ballots-how-ai-is-rewriting-political-advertising-with-scott-brennen-and-matt-perault/,"Candidates, Bots, and Ballots: How AI Is Rewriting Political Advertising (with Scott Brennen and Mat...","Candidates, Bots, and Ballots: How AI Is Rewriting Political Advertising (with Scott Brennen and Matt Perault)",6
https://www.aei.org/events/spectrum-slump-exploring-the-fccs-challenges-in-5g-leadership/,Spectrum Slump: Exploring the FCC’s Challenges in 5G Leadership,Spectrum Slump: Exploring the FCC’s Challenges in 5G Leadership,6
https://www.aei.org/technology-and-innovation/global-spectrum-harmonization-unleashing-the-potential-of-leo-satellites-for-worldwide-connectivity/,Global Spectrum Harmonization: Unleashing the Potential of Low Earth Orbit Satellites for Worldwide ...,Global Spectrum Harmonization: Unleashing the Potential of Low Earth Orbit Satellites for Worldwide Connectivity,6
