url,link_text,post_title,page
https://www.aei.org/technology-and-innovation/bringing-military-families-into-the-21st-century-highlights-from-my-conversation-with-sam-meek/,Bringing Military Families into the 21st Century: Highlights from My Conversation with Sam Meek,Bringing Military Families into the 21st Century: Highlights from My Conversation with Sam Meek,6
https://www.aei.org/technology-and-innovation/privacy-data-national-security-and-the-principles-for-data-sharing-globalization-highlights-from-my-conversation-with-sujit-raman/,"Privacy, Data, National Security, and the Principles for Data-Sharing Globalization: Highlights from...","Privacy, Data, National Security, and the Principles for Data-Sharing Globalization: Highlights from My Conversation with Sujit Raman",6
https://www.aei.org/multimedia/cracking-the-quantum-code-with-alan-baratz/,Quantum: Computing’s Next Innovation Wave (with Alan Baratz),Quantum: Computing’s Next Innovation Wave (with Alan Baratz),6
https://www.aei.org/technology-and-innovation/upskilling-from-the-top/,Upskilling from the Top,Upskilling from the Top,6
https://www.aei.org/events/digital-discourse-in-flux-navigating-the-legal-economic-and-societal-impacts-of-todays-online-speech-decisions/,"Digital Discourse in Flux: Navigating the Legal, Economic, and Societal Impacts of Today’s Online Sp...","Digital Discourse in Flux: Navigating the Legal, Economic, and Societal Impacts of Today’s Online Speech Decisions",6
https://www.aei.org/multimedia/the-paperless-revolution-with-scott-wyatt/,The Paperless Revolution with Scott Wyatt,The Paperless Revolution with Scott Wyatt,6
https://www.aei.org/events/cheap-fakes-and-dirty-politics-examining-manipulated-media-and-platform-accountability/,Cheap Fakes and Dirty Politics: Examining Manipulated Media and Platform Accountability,Cheap Fakes and Dirty Politics: Examining Manipulated Media and Platform Accountability,6
https://www.aei.org/technology-and-innovation/empowering-responsible-and-compliant-practices-bridging-the-gap-for-us-citizens-and-corporations-with-the-new-eu-us-data-privacy-framework/,Empowering Responsible and Compliant Practices: Bridging the Gap for US Citizens and Corporations wi...,Empowering Responsible and Compliant Practices: Bridging the Gap for US Citizens and Corporations with the New EU-US Data Privacy Framework,6
https://www.aei.org/podcast/securing-your-digital-life-in-an-age-of-hacks-with-harry-raduege/,Securing Your Digital Life in an Age of Hacks (with Harry Raduege),Securing Your Digital Life in an Age of Hacks (with Harry Raduege),6
https://www.aei.org/technology-and-innovation/can-we-future-proof-ai-highlights-from-my-conversation-with-rob-reich/,Can We Future-Proof AI? Highlights from My Conversation with Rob Reich,Can We Future-Proof AI? Highlights from My Conversation with Rob Reich,6
https://www.aei.org/technology-and-innovation/australias-web-watchdog-online-personal-content-scans-provoke-surveillance-concerns/,Australia’s Web Watchdog: Online Personal Content Scans Provoke Surveillance Concerns,Australia’s Web Watchdog: Online Personal Content Scans Provoke Surveillance Concerns,7
https://www.aei.org/podcast/privacy-data-national-security-and-the-principals-for-data-sharing-globalization-with-sujit-raman/,"Privacy, Data, National Security, and the Principles for Data-Sharing Globalization (with Sujit Rama...","Privacy, Data, National Security, and the Principles for Data-Sharing Globalization (with Sujit Raman)",7
https://www.aei.org/podcast/can-we-future-proof-ai-with-rob-reich/,Can We Future-Proof AI? (with Rob Reich),Can We Future-Proof AI? (with Rob Reich),7
https://www.aei.org/technology-and-innovation/unpacking-misconceptions-in-tech-antitrust-highlights-from-my-conversation-with-daniel-francis/,Unpacking Misconceptions in Tech Antitrust: Highlights from My Conversation with Daniel Francis,Unpacking Misconceptions in Tech Antitrust: Highlights from My Conversation with Daniel Francis,7
https://www.aei.org/podcast/uncertainty-technology-the-adaptability-imperative-of-automation/,Uncertainty & Technology: The Adaptability Imperative of Automation,Uncertainty & Technology: The Adaptability Imperative of Automation,7
https://www.aei.org/podcast/uncertainty-technology-the-adaptability-imperative-of-automation-live-with-brent-orrell-part-ii/,Uncertainty & Technology: The Adaptability Imperative of Automation (LIVE with Brent Orrell—Part II),Uncertainty & Technology: The Adaptability Imperative of Automation (LIVE with Brent Orrell—Part II),7
https://www.aei.org/podcast/does-big-tech-need-a-reboot/,Does Big Tech Need a Reboot?,Does Big Tech Need a Reboot?,7
https://www.aei.org/technology-and-innovation/worldcoins-introduction-to-kenyan-market-temporarily-halted-due-to-privacy-concerns/,Worldcoin’s Introduction to the Kenyan Market Is Temporarily Halted Due to Privacy Concerns,Worldcoin’s Introduction to the Kenyan Market Is Temporarily Halted Due to Privacy Concerns,7
https://www.aei.org/technology-and-innovation/from-pixels-to-prosperity-highlights-from-my-conversation-with-susan-guya-obunga-otieno/,From Pixels to Prosperity: Highlights from My Conversation with Susan Otieno,From Pixels to Prosperity: Highlights from My Conversation with Susan Otieno,7
https://www.aei.org/podcast/uncertainty-technology-the-adaptability-imperative-of-automation-live-with-brent-orrell-part-i/,Uncertainty & Technology: The Adaptability Imperative of Automation (LIVE with Brent Orrell—Part I),Uncertainty & Technology: The Adaptability Imperative of Automation (LIVE with Brent Orrell—Part I),7
https://www.aei.org/technology-and-innovation/new-cyber-trust-mark-to-enhance-iot-device-security/,New Cyber Trust Mark to Enhance IoT Device Security,New Cyber Trust Mark to Enhance IoT Device Security,7
https://www.aei.org/technology-and-innovation/the-promise-and-peril-of-ai-in-the-music-industry-highlights-from-my-conversation-with-david-hughes/,The Promise and Peril of AI in the Music Industry: Highlights from My Conversation with David Hughes,The Promise and Peril of AI in the Music Industry: Highlights from My Conversation with David Hughes,7
https://www.aei.org/technology-and-innovation/shifting-sands-of-supply-africa-china-and-the-global-race-for-rare-earth-elements/,"Shifting Sands of Supply: Africa, China, and the Global Race for Rare Earth Elements","Shifting Sands of Supply: Africa, China, and the Global Race for Rare Earth Elements",7
https://www.aei.org/events/beyond-bandwidth-addressing-spectrum-capacity-challenges-and-exploring-its-value/,Beyond Bandwidth: Addressing Spectrum-Capacity Challenges and Exploring the Mid-Band’s Value,Beyond Bandwidth: Addressing Spectrum-Capacity Challenges and Exploring the Mid-Band’s Value,7
https://www.aei.org/technology-and-innovation/do-we-need-a-reboot-challenging-prevailing-narratives-on-ai/,Do We Need a Reboot? Challenging Prevailing Narratives on AI,Do We Need a Reboot? Challenging Prevailing Narratives on AI,7
https://www.aei.org/technology-and-innovation/the-crucial-role-of-mid-band-spectrum-for-5g-and-6g-networks/,The Crucial Role of Mid-Band Spectrum for 5G and 6G Networks,The Crucial Role of Mid-Band Spectrum for 5G and 6G Networks,7
https://www.aei.org/podcast/from-serving-to-the-server-how-sandboxx-is-changing-military-life-with-sam-meek/,From Serving to the Server: How Sandboxx Is Changing Military Life (with Sam Meek),From Serving to the Server: How Sandboxx Is Changing Military Life (with Sam Meek),7
https://www.aei.org/podcast/unpacking-misconceptions-in-tech-antitrust-with-daniel-francis/,Unpacking Misconceptions in Tech Antitrust (with Daniel Francis),Unpacking Misconceptions in Tech Antitrust (with Daniel Francis),7
https://www.aei.org/events/system-error-where-big-tech-went-wrong-and-how-we-can-reboot/,System Error: Where Big Tech Went Wrong and How We Can Reboot,System Error: Where Big Tech Went Wrong and How We Can Reboot,7
https://www.aei.org/podcast/from-pixels-to-prosperity-navigating-legal-frontiers-and-disruptive-innovation-across-africa-with-susan-guya-obunga-otieno/,From Pixels to Prosperity: Navigating Legal Frontiers and Disruptive Innovation Across Africa (with ...,From Pixels to Prosperity: Navigating Legal Frontiers and Disruptive Innovation Across Africa (with Susan Otieno),7
https://www.aei.org/technology-and-innovation/regulating-artificial-intelligence-the-need-challenges-and-possible-solutions/,"Regulating Artificial Intelligence: The Need, Challenges, and Possible Solutions","Regulating Artificial Intelligence: The Need, Challenges, and Possible Solutions",8
https://www.aei.org/technology-and-innovation/where-are-we-on-spectrum-allocation-highlights-from-my-conversation-with-roger-entner/,Where Are We on Spectrum Allocation? Highlights from My Conversation with Roger Entner,Where Are We on Spectrum Allocation? Highlights from My Conversation with Roger Entner,8
https://www.aei.org/podcast/the-promise-and-peril-of-ai-in-the-music-industry-with-david-hughes/,The Promise and Peril of AI in the Music Industry (with David Hughes),The Promise and Peril of AI in the Music Industry (with David Hughes),8
https://www.aei.org/technology-and-innovation/aei-section-230-spring-summit-part-iii-highlights-from-an-expert-panel-discussion-evaluating-section-230-reform/,"AEI Section 230 Spring Summit, Part III: Highlights from an Expert Panel Discussion Evaluating Secti...","AEI Section 230 Spring Summit, Part III: Highlights from an Expert Panel Discussion Evaluating Section 230 Reform",8
https://www.aei.org/technology-and-innovation/landmark-supreme-court-ruling-safeguards-the-internets-liability-shield/,Landmark Supreme Court Rulings Safeguard the Internet’s Liability Shield,Landmark Supreme Court Rulings Safeguard the Internet’s Liability Shield,8
https://www.aei.org/technology-and-innovation/understanding-internet-modularity-highlights-from-my-conversation-with-susan-ness/,Understanding Internet Modularity: Highlights from My Conversation with Susan Ness,Understanding Internet Modularity: Highlights from My Conversation with Susan Ness,8
https://www.aei.org/podcast/the-selfish-sandbox-of-american-spectrum-allocation-with-roger-entner/,The Importance of Spectrum Harmonization (with Roger Entner),The Importance of Spectrum Harmonization (with Roger Entner),8
https://www.aei.org/technology-and-innovation/aei-section-230-spring-summit-part-ii-highlights-from-an-expert-panel-discussion-on-the-economic-value-of-section-230/,"AEI Section 230 Spring Summit, Part II: Highlights from an Expert Panel Discussion on the Economic V...","AEI Section 230 Spring Summit, Part II: Highlights from an Expert Panel Discussion on the Economic Value of Section 230",8
https://www.aei.org/technology-and-innovation/why-a-national-privacy-law-is-essential-to-the-united-states-in-a-global-digital-economy/,Why a National Privacy Law Is Essential to the United States in a Global Digital Economy,Why a National Privacy Law Is Essential to the United States in a Global Digital Economy,8
https://www.aei.org/technology-and-innovation/aei-section-230-spring-summit-part-i-highlights-from-an-expert-panel-discussion-locating-the-state-of-the-section-230-debate/,"AEI Section 230 Spring Summit, Part I: Highlights from an Expert Panel Discussion Locating the State...","AEI Section 230 Spring Summit, Part I: Highlights from an Expert Panel Discussion Locating the State of the Section 230 Debate",8
https://www.aei.org/podcast/a-network-of-networks-modularity-in-internet-governance-with-susan-ness/,A Network of Networks: Modularity in Internet Governance (with Susan Ness),A Network of Networks: Modularity in Internet Governance (with Susan Ness),8
https://www.aei.org/technology-and-innovation/how-do-we-secure-the-internet-highlights-from-my-conversation-with-paul-kupiec-and-thomas-vartanian/,How Do We Secure the Internet? Highlights from My Conversation with Paul Kupiec and Thomas Vartanian,How Do We Secure the Internet? Highlights from My Conversation with Paul Kupiec and Thomas Vartanian,8
https://www.aei.org/events/aei-section-230-spring-summit/,AEI Section 230 Spring Summit,AEI Section 230 Spring Summit,8
https://www.aei.org/podcast/one-world-two-webs-can-we-make-a-more-secure-internet-with-paul-kupiec-and-thomas-vartanian/,"One World, Two Webs: Can We Make A More Secure Internet? (with Paul Kupiec and Thomas Vartanian)","One World, Two Webs: Can We Make A More Secure Internet? (with Paul Kupiec and Thomas Vartanian)",8
https://www.aei.org/technology-and-innovation/the-fcc-space-edition-highlights-from-my-conversation-with-michael-orielly/,"The FCC, Spectrum Edition: Highlights from My Conversation with Michael O’Rielly","The FCC, Spectrum Edition: Highlights from My Conversation with Michael O’Rielly",8
https://www.aei.org/technology-and-innovation/government-software-procurement-modernization-highlights-from-my-conversation-with-ryan-triplette/,Government Software Procurement Modernization: Highlights from My Conversation with Ryan Triplette,Government Software Procurement Modernization: Highlights from My Conversation with Ryan Triplette,8
https://www.aei.org/technology-and-innovation/why-are-we-trying-to-regulate-our-way-to-innovation/,Why Are We Trying to Regulate Our Way to Innovation?,Why Are We Trying to Regulate Our Way to Innovation?,8
https://www.aei.org/podcast/procuring-security-government-software-modernization-with-ryan-triplette/,Procuring Security: Government Software Modernization (with Ryan Triplette),Procuring Security: Government Software Modernization (with Ryan Triplette),8
https://www.aei.org/technology-and-innovation/whats-under-the-hood-with-right-to-repair-highlights-from-my-conversation-with-jeff-westling/,What’s Under the Hood with “Right to Repair”? Highlights from My Conversation with Jeff Westling,What’s Under the Hood with “Right to Repair”? Highlights from My Conversation with Jeff Westling,8
https://www.aei.org/podcast/spectrum-satellites-and-subsidies-telecommunications-decision-points-in-2023-with-michael-orielly/,"Spectrum, Satellites, and Subsidies: Telecommunications Decision Points in 2023 (with Michael O’Riel...","Spectrum, Satellites, and Subsidies: Telecommunications Decision Points in 2023 (with Michael O’Rielly)",8
https://www.aei.org/technology-and-innovation/the-2023-munich-security-conference-is-putting-the-cyber-in-international-security-highlights-from-my-conversation-with-benedikt-franke/,The 2023 Munich Security Conference Is Putting the “Cyber” in International Security: Highlights fro...,The 2023 Munich Security Conference Is Putting the “Cyber” in International Security: Highlights from My Conversation with Benedikt Franke,9
https://www.aei.org/podcast/what-does-the-right-to-repair-really-mean-with-jeff-westling/,What Does the Right to Repair Really Mean? (with Jeff Westling),What Does the Right to Repair Really Mean? (with Jeff Westling),9
https://www.aei.org/articles/digital-wallets-are-the-future-for-faster-access-and-more-secure-transactions/,"Digital Wallets Are the Future for Faster Access, and More Secure Transactions","Digital Wallets Are the Future for Faster Access, and More Secure Transactions",9
https://www.aei.org/technology-and-innovation/how-tech-is-putting-your-health-in-your-hands/,How Tech Is Putting Your Health in Your Hands,How Tech Is Putting Your Health in Your Hands,9
https://www.aei.org/podcast/the-munich-security-conference-at-60-promoting-international-cooperation-trust-and-digital-security-with-benedikt-franke/,"The Munich Security Conference at 60: Promoting International Cooperation, Trust, and Digital Securi...","The Munich Security Conference at 60: Promoting International Cooperation, Trust, and Digital Security (with Benedikt Franke)",9
https://www.aei.org/technology-and-innovation/japans-precarious-digital-markets-crossroads/,Japan’s Precarious Digital Markets Crossroads,Japan’s Precarious Digital Markets Crossroads,9
https://www.aei.org/technology-and-innovation/home-network-invasion-highlights-from-an-expert-panel-discussion-on-cybersecurity-and-the-internet-of-things/,Home Network Invasion: Highlights from an Expert Panel Discussion on Cybersecurity and the Internet ...,Home Network Invasion: Highlights from an Expert Panel Discussion on Cybersecurity and the Internet of Things,9
https://www.aei.org/podcast/does-the-u-s-have-global-tech-superiority-our-china-challenge-going-forward-with-james-lewis/,Does the U.S. Have Global Tech Superiority? Our China Challenge Going Forward (with James Lewis),Does the U.S. Have Global Tech Superiority? Our China Challenge Going Forward (with James Lewis),9
https://www.aei.org/podcast/can-transatlantic-cooperation-transform-the-china-tech-race-with-peter-brown/,Can Transatlantic Cooperation Transform the China Tech Race? (with Peter Brown),Can Transatlantic Cooperation Transform the China Tech Race? (with Peter Brown),9
https://www.aei.org/technology-and-innovation/have-we-turned-a-blind-eye-to-cybersecurity-highlights-from-my-conversation-with-ambassador-robert-obrien/,Have We Turned a Blind Eye to Cybersecurity? Highlights from My Conversation with Ambassador Robert ...,Have We Turned a Blind Eye to Cybersecurity? Highlights from My Conversation with Ambassador Robert O’Brien,9
https://www.aei.org/technology-and-innovation/separating-fact-from-fiction-in-election-information-online-highlights-from-an-expert-panel-discussion-on-section-230-and-the-midterms/,Separating Fact from Fiction in Election Information Online: Highlights from an Expert Panel Discuss...,"Separating Fact from Fiction in Election Information Online: Highlights from an Expert Panel Discussion on Section 230, Internet Content, and the Midt...",9
https://www.aei.org/technology-and-innovation/the-lame-duck-hunt-closing-big-tech-open-season/,The Lame-Duck Hunt: Closing Big Tech Open Season,The Lame-Duck Hunt: Closing Big Tech Open Season,9
https://www.aei.org/podcast/have-we-turned-a-blind-eye-to-cybersecurity-with-ambassador-robert-obrien/,Have We Turned a Blind Eye to Cybersecurity? (with Ambassador Robert O’Brien),Have We Turned a Blind Eye to Cybersecurity? (with Ambassador Robert O’Brien),9
https://www.aei.org/technology-and-innovation/establishing-global-spectrum-leadership-and-a-modern-fcc-highlights-from-my-conversation-with-ajit-pai-part-ii/,Establishing Global Spectrum Leadership and a Modern FCC: Highlights from My Conversation with Ajit ...,"Establishing Global Spectrum Leadership and a Modern FCC: Highlights from My Conversation with Ajit Pai, Part II",9
https://www.aei.org/events/where-should-the-security-lie-in-our-networks/,Where Should the Security Lie in Our Networks?,Where Should the Security Lie in Our Networks?,9
https://www.aei.org/technology-and-innovation/establishing-global-spectrum-leadership-and-a-modern-fcc-highlights-from-my-conversation-with-ajit-pai-part-i/,Establishing Global Spectrum Leadership and a Modern FCC: Highlights from My Conversation with Ajit ...,"Establishing Global Spectrum Leadership and a Modern FCC: Highlights from My Conversation with Ajit Pai, Part I",9
https://www.aei.org/events/separating-fact-from-fiction-election-disinformation-on-online-platforms/,Separating Fact from Fiction: Election Disinformation on Online Platforms,Separating Fact from Fiction: Election Disinformation on Online Platforms,9
https://www.aei.org/podcast/establishing-global-spectrum-leadership-and-a-modern-fcc-live-with-ajit-pai/,Establishing Global Spectrum Leadership and a Modern FCC (LIVE with Ajit Pai),Establishing Global Spectrum Leadership and a Modern FCC (LIVE with Ajit Pai),9
https://www.aei.org/technology-and-innovation/all-tricks-no-treats-when-it-comes-to-cyber-scams/,"All Tricks, No Treats When It Comes to Cyber Scams","All Tricks, No Treats When It Comes to Cyber Scams",9
https://www.aei.org/technology-and-innovation/assessing-the-many-hats-of-cybersecurity-governance-highlights-from-my-conversation-with-jason-blessing/,Assessing the Many Hats of Cybersecurity Governance: Highlights from My Conversation with Jason Bles...,Assessing the Many Hats of Cybersecurity Governance: Highlights from My Conversation with Jason Blessing,9
https://www.aei.org/technology-and-innovation/growing-the-e-commerce-pie-for-microbusiness-entrepreneurs-highlights-from-my-conversation-with-alex-rosen/,Growing the E-Commerce Pie for Microbusiness Entrepreneurs: Highlights from My Conversation with Ale...,Growing the E-Commerce Pie for Microbusiness Entrepreneurs: Highlights from My Conversation with Alex Rosen,10
https://www.aei.org/technology-and-innovation/the-open-app-markets-act-threatening-user-data-one-device-at-time/,"The Open App Markets Act: Threatening User Data, One Device at a Time","The Open App Markets Act: Threatening User Data, One Device at a Time",10
https://www.aei.org/technology-and-innovation/combatting-the-problem-of-domain-name-abuse-highlights-from-a-conversation-with-graeme-bunton/,Combatting the Problem of Domain Name Abuse: Highlights from a Conversation with Graeme Bunton,Combatting the Problem of Domain Name Abuse: Highlights from a Conversation with Graeme Bunton,10
https://www.aei.org/technology-and-innovation/modernizing-the-federal-identity-system-highlights-from-a-conversation-with-jordan-burris/,Modernizing the Federal Identity System: Highlights from a Conversation with Jordan Burris,Modernizing the Federal Identity System: Highlights from a Conversation with Jordan Burris,10
https://www.aei.org/podcast/effectively-managing-cyber-challenges-in-the-public-and-private-sectors-with-jason-blessing/,Effectively Managing Cyber Challenges in the Public and Private Sectors (with Jason Blessing),Effectively Managing Cyber Challenges in the Public and Private Sectors (with Jason Blessing),10
https://www.aei.org/podcast/helping-local-microbusinesses-thrive-with-alex-rosen/,Helping Local “Microbusinesses” Thrive (with Alex Rosen),Helping Local “Microbusinesses” Thrive (with Alex Rosen),10
https://www.aei.org/podcast/combatting-the-problem-of-domain-name-abuse-with-graeme-bunton/,Combatting the Problem of Domain Name Abuse (with Graeme Bunton),Combatting the Problem of Domain Name Abuse (with Graeme Bunton),10
https://www.aei.org/technology-and-innovation/reining-in-chinas-dominance-of-the-international-telecommunication-union-highlights-from-my-conversation-with-danielle-pletka-brett-schaefer-and-dominique-lazanski/,Reining in China’s Dominance of the International Telecommunication Union: Highlights from My Conver...,"Reining in China’s Dominance of the International Telecommunication Union: Highlights from My Conversation with Danielle Pletka, Brett Schaefer, and D...",10
https://www.aei.org/technology-and-innovation/the-national-telecommunications-and-information-administration-steps-beyond-congress-purview-in-broadband-deployment-plans/,The National Telecommunications and Information Administration Steps Beyond Congress’s Purview in Br...,The National Telecommunications and Information Administration Steps Beyond Congress’s Purview in Broadband Deployment Plans,10
https://www.aei.org/podcast/can-we-modernize-the-federal-identity-system-with-jordan-burris/,Can We Modernize the Federal Identity System? (with Jordan Burris),Can We Modernize the Federal Identity System? (with Jordan Burris),10
https://www.aei.org/podcast/reining-in-chinas-dominance-of-the-international-telecommunication-union-with-danielle-pletka-brett-schaefer-and-dominique-lazanski/,"Reining in China’s Dominance of the International Telecommunication Union (with Danielle Pletka, Bre...","Reining in China’s Dominance of the International Telecommunication Union (with Danielle Pletka, Brett Schaefer, and Dominique Lazanski)",10
https://www.aei.org/technology-and-innovation/how-to-think-like-an-entrepreneur-highlights-from-my-conversation-with-jason-feifer/,How to Think Like an Entrepreneur: Highlights from My Conversation with Jason Feifer,How to Think Like an Entrepreneur: Highlights from My Conversation with Jason Feifer,10
https://www.aei.org/podcast/building-for-tomorrow-how-to-think-like-an-entrepreneur-with-jason-feifer/,“Building for Tomorrow”: How to Think Like an Entrepreneur (with Jason Feifer),“Building for Tomorrow”: How to Think Like an Entrepreneur (with Jason Feifer),10
https://www.aei.org/technology-and-innovation/can-billions-of-dollars-in-federal-grants-solve-broadband-access-and-availability-throughout-the-us-highlights-from-fcc-commissioner-brendan-carr-and-an-expert-panel-discussion/,Can Billions of Dollars in Federal Grants Solve Broadband Access and Availability Throughout the US?...,Can Billions of Dollars in Federal Grants Solve Broadband Access and Availability Throughout the US? Highlights from FCC Commissioner Brendan Carr and...,10
https://www.aei.org/op-eds/more-than-networks-america-needs-better-cybersecurity/,"More Than Networks, America Needs Better Cybersecurity","More Than Networks, America Needs Better Cybersecurity",10
https://www.aei.org/technology-and-innovation/crossing-the-consumer-welfare-rubicon-highlights-from-a-conversation-with-ftc-commissioner-noah-phillips/,Crossing the Consumer Welfare Rubicon: Highlights from a Conversation with FTC Commissioner Noah Phi...,Crossing the Consumer Welfare Rubicon: Highlights from a Conversation with FTC Commissioner Noah Phillips,10
https://www.aei.org/technology-and-innovation/the-paypal-pioneers-of-silicon-valley-highlights-from-my-conversation-with-jimmy-soni/,The PayPal Pioneers of Silicon Valley: Highlights from My Conversation with Jimmy Soni,The PayPal Pioneers of Silicon Valley: Highlights from My Conversation with Jimmy Soni,10
